Sentence,Year
être candidat pour une fonction officielle dans un éventuel gouvernement démocrate chrétien issu des élections du novembre afp m schiller aurait,1972
aurait voulu adhérer au parti libéral après sa démission du parti social démocrate spd il avait posé pour condition que m,1972
linéaire de telle qu elle a été proposée par le parti démocrate chrétien n est pas réalisable et que pour réduire,1972
d autres blessées selon la police la victime appartenait au parti démocrate chrétien opposition centriste ce parti a déclaré que les,1972
participation le pdc annonce un contre projet berne ats le parti démocrate chrétien suisse a élaboré un contre projet à l,1973
actuellement le seul candidat en lice à la présidence du parti démocrate chrétien de suisse pdc les délégués du pdc qui,1973
donner son avis sur certaines questions de droit électoral le parti démocrate chrétien suisse s est claré favorable à une réforme,1973
wyer a été élu vendredi soir à la présidence du parti démocrate chrétien suisse,1973
assemblée du parti démocrate chrétien à sion le pdc approuve les articles constitutionnels,1973
et samedi en assemblée à sion près de délégués du parti démocrate chrétien suisse pdc ont décidé d approuver par voix,1973
cantonale du valais m wyer âgé de ans président du parti chrétien social haut valaisan colonel emg prend ainsi la succession,1973
les démocrates chrétiens vaudois préparent les élections communales le parti démocrate chrétien vaudois a tenu vendredi et samedi à jongny,1973
aujourd hui que seule l élection du conseiller d etat démocrate chrétien du haut valais va créer le suspense de cette,1973
tout nouveau mandat selon une répartition établie c est un démocrate chrétien de la partie alémanique du canton qui devra prendre,1973
se prononcent contre une augmentation du nombre des signatures le parti démocrate chrétien suisse pense également qitil n y a pas,1973
écarter un candidat pour des raisons politiques car il est démocrate chrétien et non agrarien udc la majorité des membres de,1973
minoritaires contestèrent cette vision des choses on évoque du côté démocrate chrétien le fait que dans le haut valais par exemple,1973
chrétien séparatiste francophone l upj fait l amalgamue entre le parti démocrate chrétien et le rassemblement jurassien pour l heure dans,1973
jura en assemblée générale un seul parti le parti crate chrétien a pris position sur le rapport jura le décembre relevant,1973
les deux hommes ont affronté les centaines de délégués du parti démocrate chrétien réuni à glis lors de l ultime congrès,1973
changement d étiquette auxquels ont procédé avant lui l ancien parti conservateur chrétien social et l ancien parti des paysans artisans,1973
la presse hier les principaux responsables du comité directeur du parti démocrate chrétien du valais parti qui groupe actuellement de l,1973
finalement n affronteront le peuple sur la liste officielle du parti démocrate chrétien que les quatre candidats que l on sait,1973
aux journalistes du palais berne ats le comité directeur du parti démocrate chrétien suisse lors de sa dernière séance s est,1973
tous du pdc m arthur bender radical m mario ruppen démocrate chrétien du haut valais et m maurice deléglise du mouvement,1973
à viège avec candidats dont l écrivain pierre imhasly le parti démocrate à conches et le parti social démocrate et haut,1973
valais non m ruppenl brigue ats le comité directeur du parti démocrate chrétien du haut valais a dans une déclaration pris,1973
partis et associations leurs positions oui oui les partis socialiste démocrate chrétien radical union démocratique du centre parti du travail parti,1973
genève grisons glaris argovie et thurgovie les sections cantonales du parti démocrate chrétien des cantons du valais et de thurgovie et,1973
pdc avec franz steiner de brigue pdc avec mario ruppen démocrate chrétien de viège avec maurice deléglise de sion mouvement démocrate,1973
dans le jura cette initiative socialiste était soutenue par le parti chrétien social indépendant et combattue par le parti radical et,1973
le parti radical et l union démocratique du centre le parti démocrate chrétien avait laissé la liberté de vote les districts,1973
serré en effet si le oui était préconisé par le parti démocrate chrétien le parti du travail le parti socialiste et,1973
les deux chambres et fait élire leurs principaux dirigeants le parti démocrate chrétien reste la plus importante formation politique mais les,1973
se réunir en session constitutive la première quinzaine de mai parti démocrate chrétien parti radical démocratique parti socialiste mouvement social indépendant,1973
chrétien parti radical démocratique parti socialiste mouvement social indépendant mouvement démocrate sédunois parti radical libéral mouvement démocrate parti chrétien social dans,1973
conseil national ces modifications interviendront généralement au détriment des partis démocrate chrétien et socialiste avant la décision le mouvement républicain ne,1973
il en est de même du candidat officiel du paiti démocrate chrétien appelé à remplacer m ernest von roten démissionnaire feront,1973
part les vertes critiques adressées au rassemblement jurassien et au parti démocrate chrétien du jura dont les attitudes sont considérées comme,1973
m roger mugny conseiller national l assemblée des délégués du parti démocrate chrétien vaudois a cidé à l unanimité de recommander,1973
olten ats réunis en assemblée à olten les délégués du parti démocrate chrétien pdc ont décidé à l unanimité soit par,1973
des articles et de son côté le comité cantonal du parti indépendant chrétien social fribourgeois a pris position face aux votations,1973
ruffieux a informé la direction de son parti le parti démocrate chrétien qu il ne sollicitera pas le renouvellement de son,1973
compte dans notre édition d hier grisons bon en avant démocrate chrétien coire ats les élections qui se sont déroulées ce,1973
lieu dimanche se sont soldées par une nette victoire du parti démocrate chrétien au détriment de l alliance des indépendants le,1973
ancien voix rudolf bachmann socialiste ancien voix et alfred rôtheli démocrate chrétien nouveau voix la participation au scrutin s est élevée,1973
est formé d une radicale d un libéral d un démocrate chrétien d un socialiste et d un communiste le conseil,1973
des ans ce journal est devenu également l organe du parti conservateur catholique et aujourd hui du parti démocrate chrétien jurassien,1973
le titre vous exagérez m graber le quotidien proche du parti démocrate chrétien saint gallois est d avis que la décision,1973
l objet d une r accusation constitutionnelle lancée par le parti démocrate chrétien opposition centriste et immédiatement appuyée par le parti,1973
parti démocrate chrétien opposition centriste et immédiatement appuyée par le parti national conservateur ainsi que par les autres groupes de l,1973
due au fait que le parti national qui avec le parti démocrate chrétien est un des pi liers de l opposition,1973
demandent au tribunal fédéral de prononcer un effet suspensif le parti démocrate chrétien qui est également opposé à la nouvelle disposition,1973
du chili le président salvador allende et les représentants du parti démocrate chrétien chilien ont entamé lundi le dialogue proposé il,1973
été décidé par le chef de l etat et le parti démocrate chrétien a accepté l invitation qui lui était faite,1973
ci en revanche est approuvé pour l essentiel par le parti démocrate chrétien l alliance des indépendants et le parti du,1973
gouverner conformément à la loi ce texte présenté par le parti démocrate chrétien affirme que le gouvernement a violé le principe,1973
de la proposition suivante faite le janvier dernier par le parti démocrate chrétien pdc la confédération est autorisée à établir des,1973
l initiative votation sur la chasse le comité directeur du parti démocrate chrétien vaudois a décidé de recommander le rejet de,1973
confédération suisse des offres très précises ont été faites au parti démocrate chrétien jurassien en ce qui concerne sa participation au,1973
depuis et conseiller national depuis seront les deux candidats du parti démocrate chrétien pdc cet automne lors de l élection du,1973
le parti socialiste les so ciaux indépendants et le groupement chrétien social de sion ont pris position contre mais on enregistre,1973
elections communales lausannoises le parti démocrate chrétien présente candidats le parti démocrate chrétien lausannois qui,1973
fédéral dates fixées berne ats a berne les groupes socialiste démocrate chrétien et radical des chambres fédérales ont déjà commencé à,1973
de proposition se réunira le novembre au matin le groupe démocrate chrétien pdc qui avait cidé de traiter de ce sujet,1973
h hiirlimann comme candidat au conseil fédéral zoug ats le parti démocrate chrétien pdc du canton de zoug a désigné le,1973
elections au conseil d etat genevois deux candidats du parti démo chrétien genève ats réunis jeudi soir les délégués du,1973
démo chrétien genève ats réunis jeudi soir les délégués du parti démocrate chrétien genevois pdc ont confirmé les candidatures de mm,1973
dans sa prise de position en faveur du projet le parti démocrate chrétien remarque que si l on entend trouver le,1973
et y ayant finalement renoncé en raison des réticences du parti démocratique chrétien dans l ordre d inscription les listes sont,1973
de mme jacqueline heinen et celles du parti radical du parti démocrate chrétien du parti libéral et d une entente genevoise,1973
revanche se faisait déjà pour les trois partis nationaux radical démocrate chrétien et libéral le scrutin se fait selon le système,1973
réuni samedi à carouge ge en assemblée des délégués ie parti démocrate chrétien suisse a recommandé l acceptation des quatre arrêtés,1973
uranais au conseil fédéral altdorf ats le comité central du parti démocrate chrétien dn canton d uri a proposé à l,1973
les licenciements jeudi er conseil fédéral le comité central du parti démocrate chrétien d uri a décidé de proposer au groupe,1973
on relève un renouvellement sur lequel on s interroge du parti démocrate chrétien en fait il n est que dans les,1973
tessinnois propose m franzoni bellinzone ats le comité central du parti démocrate chrétien tessinois réuni samedi à bellinzone sous la présidence,1973
parti a décidé à l unanimité de soumettre au groupe démocrate chrétien de l assemblée fédérale la candidature au conseil fédéral,1973
de l année m roger bonvin président de la confédération démocrate chrétien également qui vient de démissionner groupe socialiste m canonica,1973
le communiqué il estime que le problème essentiel est du parti démocrate chrétien au sein du conseil exécutif ce qui devrait,1973
preyard union démocratique de saint prex parti socialiste parti radical démocrate mouvement populaire vaudois pour l environnement première fois que cette,1973
brunschwig didier martin auguste glardon ernest pache jean dormond pierre parti démocrate chrétien gardaz jacques constantin charles théraulaz gabriel matthey doret,1973
dutschler hector mayor gérald ernest charles henri bernard dré mottaz démocrate chrétien franz amrhein jean knobel jean gottardi daniel morand michel,1973
paul berthoud charly keuffer robert masson michel lauquin richard chevaux parti démocrate chrétien sièges joseph husser hubert roubaty gabriel tcrrapon jean,1973
autre part le fait que les partis libéral radical et démocrate chrétien détiennent à eux trois quarante cinq sièges contre quarante,1973
saurait passer sous silence signalons enfin que m mugny municipal démocrate chrétien vient lui aussi le premier de sa liste il,1973
et delamuraz pour le parti radical m mugny pour le parti démocrate chrétien enfin m deppen pour le parti socialiste tous,1973
proposé par le gouvernement statut vide de réformes essentielles rejet démocrate chrétien et appel au conseil fédéral jusqu à ce jour,1973
générales pour arrêter leur position sur le rapport gouvernemental le parti démocrate chrétien le décembre le parti radical et le parti,1973
parti démocrate chrétien le décembre le parti radical et le parti chrétien social indépendant le octobre le parti socialiste de l,1973
parole le porte parole de la députation jurassienne le député démocrate chrétien pruntrutain roland voisin a posé vin petit drapeau jurassien,1973
souverain le groupe udc est favorable à une participation du parti démocrate chrétien jurassien au conseil exécutif il est d avis,1973
le cadre du canton de berne aucun représentant du groupe démocrate chrétien n a pris la parole le porte parole du,1973
mesure d exercer ses fonctions pour le député a cattin démocrate chrétien saignelégier vice président de la commission parlementaire il est,1973
lundi quelques orateurs jurassiens ont adressé des critiques au député démocrate chrétien roland voisin porrentruy lui reprochant d avoir émis des,1973
conseil a abordé ensuite l étude d une participation du parti mocrate chrétien jurassien au gouvernement il a approuvé par voix,1973
que des démarches soient entreprises en vue d associer le parti démocrate chrétien du jura aux responsabilités gouvernementales en ce qui,1973
conjoncturels après le pdc de sierre c est tout le parti démocrate chrétien du valais central réuni à sion sous la,1973
a obtenu voix il succède ainsi pour une année au démocrate chrétien tessinois franzonl candidat du pdc au conseil fédéral au,1973
son vice président en la personne de m heinrich oechslin démocrate chrétien de schwyz qui a obtenu voix la majorité absolue,1973
élu par voix le second scrutateur sera m robert reimann démocrate chrétien d argovie élu par voix quant à m willi,1973
quatre oui un non le décembre le comité directeur du parti crate chrétien vaudois a décidé de recommander l acceptation des,1973
souhaiter que les autres cantons suivent cet exemple enfin le parti démocrate chrétien vaudois regrette le préavis de la commission fédérale,1973
cotisation fixe proportionnelle au salaire les maîtres queux du pdc démocrate chrétien vaudois l ancien syndicaliste mugny aimerait trouver un terrain,1973
les plus capables pdc l approvisionnement en énergie le groupe démocrate chrétien de l assemblée fédérale a discuté longuement lors de,1973
chrétienssociaux du canton de zoug avant de devenir président du parti conservateur chrétien social de son canton et enfin membre du,1973
de son canton et enfin membre du comité directeur du parti démocrate chrétien suisse dans l armée m hurlimann est colonel,1973
été exposées en déjà à la commission des par le parti démocrate chrétien le plus fort du district la région périphérique,1973
de presque tous les partis nationaux à l exception du parti démocrate chrétien et du parti évangélique populaire qui se rangent,1973
le quotidien le pays de porrentruy le comité jurassien du parti crate chrétien qui s est réuni pour faire le point,1973
des affaires militaires du canton de zoug est membre du parti démocrate chrétien ces deux mandats ne seront probablement pas contestés,1973
régime n accepteront jamais dans leurs rangs le président du parti démocrate chrétien m edouardo frei parce qu il a été,1974
union démocratique du centre ancien pab socialistes radicaux représentants du parti démocrate chrétien et membres du groupe indépendant viennent s ajouter,1974
du parti évangélique populaire deux de jeune berne un du parti chrétien social indépendant et un du parti libéral radical indépendant,1974
opposera à tout retard dans ce domaine pdc le groupe démocrate chrétien de l assemblée fédérale a discuté une nouvelle fois,1974
de m roger mugny conseiller national rassemblée des délégués du parti démocrate chrétien vaudois a décidé par voix contre et deux,1974
voix contre la majorité l emporte les ultras lehner le démocrate chrétien raissig le radical sont déboutés en début d après,1974
action nationale et l union des groupements libres que le parti démocrate chrétien renens en effet qui fait partie de cet,1974
qu est ce que le parti démocrate chrétien le décembre l assemblée du parti conservateur chrétien,1974
parti démocrate chrétien le décembre l assemblée du parti conservateur chrétien social en adoptant la nouvelle dénomination de parti démocrate chrétien,1974
chrétien social en adoptant la nouvelle dénomination de parti démocrate chrétien pdc se donnait des statuts nouveaux qui faisait d une,1974
ce parti intitulé à l origine mouvement démocrate populaire puis parti chrétien social il se réclame des principes idéologiques de la,1974
électorale il est significatif d ailleurs de voir apparaître le parti démocrate chrétien dans les alliances des partis du centre et,1974
valeurs que le christianisme a apporté au monde le partie démocrate chrétien fonde sa politique sur trois principes essentiels du personnalisme,1974
équilibre général intervient la solidarité c est ainsi que le parti mocrate chrétien élaborant son nouveau programme en propose non une,1974
canton représenté aux chambres fédérales par un conseiller national le parti démocrate chrétien vaudois occupe sept sièges au parlement cantonal ne,1974
réponses qu il a reçues les grands partis sauf le parti démocrate chrétien pdc et les organisations féminines se sont prononcés,1974
défense nationale critiques au synode berne ats la présidence du parti crate chrétien pdc réunie à berne sous la présidence du,1974
luoerne nidwald zoug baie ville et saint ainsi que le parti démocrate chrétien suisse le département politique fédéral la division de,1974
pdc suisse et jura l assemblée des délégués du parti démocrate chrétien suisse s est tenue samedi à bienne elle,1974
grand conseil au cours de l assemblée des délégués du parti démocrate chrétien des franches montagnes vendredi soir après avoir été,1974
homme et appuyé officieusement par l eglise catholique et le parti démo chrétien le référendum a été officiellement proposé parce que,1974
succès s est concrétisé aussi grâce aux forces vives du parti démocrate chrétien et de l eglise catholique certes l appui,1974
cela se vérifie à travers la voix du quotidien du parti démo chrétien tessinois et de celle du journal catholique du,1974
porrentruy apparentement entre les listes des partis démocratechrétien pdc socialiste chrétien social indépendant pcsi et libéral radical indépendant plri d une,1974
pas s engager il n y a guère que le parti démocrate chrétien jurassien dont on voit bien qu il penche,1974
la suivante udc sans changement parti socialiste parti radical parti démocrate chrétien sans changement action nationale ces cinq partis pourront former,1974
pourront former un groupe parlementaire parti évangélique alliance des indépendants parti chrétien social indépendant parti libéral radical indépendant sans changement organisations,1974
électeur il s agit de huit socialistes trois udc un démocrate chrétien un libéral radical indépendant un radical et un indépendant,1974
udc trois radicales deux socialistes et d une représentante du parti démocrate chrétien elles représenteront les cercles de berne ville berne,1974
figurent le parti socialiste suisse le parti évangélique populaire le parti démocrate chrétien et l alliance des indépendants on trouve également,1974
volonté des électeurs de s émanciper de l emprise du parti démocrate chrétien et de la tutelle morale d une partie,1974
de la suisse propositions d un groupe d étude du parti démocrate chrétien le parti démocrate chrétien a été comme tous,1974
de berne jacques simon eggly le groupe d étude du parti démocrate chrétien qui s est penché sur la question remarque,1974
désormais sur des bases plus saines le groupe d étude démocrate chrétien admet que l économie énergétique doit demeurer une économie,1974
grâce au procédé de gazéification souterraine le groupe d étude démocrate chrétien estime que la coordination plus poussée qu il demande,1974
radical et mm w krattiger alliance des indépendants marcel wermeille parti démocrate chrétien et j j reymond n appartenant à aucun,1974
la loi sur le cinéma lors du récent synode le parti démocrate chrétien avait invité ses électeurs à voter selon leur,1974
glissement vers le parti communiste et un recul sensible du parti démocrate chrétien après bulletins dépouillés les communistes ont un score,1974
antiséparatistes se déclarent déçus satisfaction chez les démocrates chrétiens le parti démocrate chrétien delémont ats le parti démocrate chrétien du jura,1974
hug pdc a été élu à alpnach et aloïs omlin chrétien social à sachseln la participation a été respectivement de et,1974
coup de tonnerre qui retentit dans le ciel valaisan le parti démocrate chrétien décide de porter le nom de m bender,1974
il n entrait pas dans la vocation de l électorat démocrate chrétien d assurer l élection d un candidat radical quand,1974
depuis m guy genoud appartient à l aile droite du parti démocrate chrétien valaisan comme les démocrates chrétiens valaisans appartiennent eux,1974
l avortement la famille la propriété toutes valeurs que le parti démocrate chrétien suisse modèle défend eneme certes mais qu il,1974
l efficacité des dites émissions tel est l avis du parti démocrate chrétien suisses pdc qui dans un communiqué publié en,1974
partagés sur les tâches de la commission alors que le parti démocrate chrétien propose l étude de toutes les possibilités le,1974
à la e initiative contre l emprise étrangère assemblée du parti démocrate chrétien bâle ats réunis samedi en assemblée dans le,1974
assemblée dans le nouveau théâtre de bâle les délégués du parti démocrate chrétien suisse pdc ont rejeté par voix sans opposition,1974
et les votations du octobre samedi le comité directeur du parti démocrate chrétien valaisan faisait savoir qu il avait dé à,1974
goût du socialiste saint gallois eggenberger ni de celui du démocrate chrétien bodenmann qui ont proposé de ne pas entrer en,1974
d argovie une version atténuée du proiet présentée par le démocrate chrétien uranais muheim a été rejetée par voix contre,1974
avance pour le landbote la position qu a prise le parti démocrate chrétien contribuera certainement à faire sortir des urnes un,1974
la cantonnant au niveau de l exploitation mais lorsque le parti démocrate chrétien alors qu il refuse dans sa majorité la,1974
zoug le congrès du parti radical et l assemblée du parti démocrate chrétien du canton de schwyz ont dit non à,1974
assis aux tables des députés ce sont les délégués du parti démocrate chrétien suisse ils tiennent congrès de leurs délibérations sortiront,1974
d affaires et de l impôt fédéral direct au congrès démocrate chrétien m furgler sera la doublure du radical chevallaz auteur,1974
l heure m hofmann un délégué jurassien appuiera le jeune démocrate chrétien arguant de la défense de la famille combat si,1974
son fauteuil présidentiel à mme ribi conseillère nationale contrairement au parti démocrate chrétien le parti radical a invité un partisan authentique,1974
futur cabinet le parti socialiste italien en effet et le parti social démocrate sont aux antipodes de la vie politique italienne,1974
partielles qui ont été marquées par un certain fléchissement du parti démocrate chrétien m moro revient donc au pouvoir au milieu,1974
premier vice président a été choisi dans les rangs du parti démocrate chrétien en la personne de m françois gagnière qui,1974
e majorité absolue de suffrages les deux scrutateurs seront le démocrate chrétien jea n curdy suffrages et la libérale simone carey,1974
de la députation jurassienne les deux partis historiques radical et démocrate chrétien dominent toujours la scène politique surtout dans le jura,1975
a d autres formations politiques hormis les dissidences du part démocrate chrétien et du parti radical à dire le parti chrétien,1975
démocrate chrétien et du parti radical à dire le parti chrétien social indépendant et le parti radical indépendant de s affirmer,1975
à la longue le comportement du parti radical et du parti démocrate chrétien la répartition géographique de la députation jurassienne de,1975
ats réunis à lenzerheide dans les grisons les délégués du parti crate chrétien suisse se sont prononcés par voix contre en,1975
par le parti du travail le parti socialiste et le parti démocrate chrétien et combattu par les radicaux les libéraux les,1975
m roger mugny conseiller national l assemblée des délégués du parti démocrate chrétien vaudois a décidé par quarante voix contre six,1975
la politique conjoncturelle et grisonnais thusis ats les délégués du parti crate chrétien pdc du canton des grisons qui tenaient leur,1975
le mouvement démocratique portugais mpd le parti socialiste et le parti démocrate chrétien pdc et l union démocratique populaire udp,1975
harmonieux de la région sud bienne seeland deux conseillers du parti démocrate chrétien se sont abstenus de signer la déclaration le,1975
