Sentence,Year
avec conseillers sur âgés de ans ou plus le groupe démocrate chrétien demeure relativement jeune bien qu il ait également tendance,1977
pour le pai udc et une sur douze pour le parti démocrate chrétien a remarquer qu un vaudois sur douze pense,1977
juge suppléant au tribunal des assurances devait être désigné le parti démocrate chrétien présentait le conseiller national grison luregn mathias cavelty,1977
vertu de la règle de l incompatibilité un autre candidat démocrate chrétien lui aussi m cavelty fut néanmoins élu par voix,1977
crate chrétien thomas cueni qui a fait savoir que le parti démocrate chrétien appuierait sans réserve l initiative populaire qui demandera,1977
du pdc vaudois réunis en assemblée extraordinaire les délégués du parti démocrate chrétien vaudois ont pris position sur les divers objets,1977
révolutionnaire préconisent le oui non les partis vigilance radical et démocrate chrétien le non oui et le parti libéral le non,1977
à l initiative oui au contreprojet de l assemblée fédérale parti démocrate chrétien non à l initiative oui au contreprojet union,1977
ordre des différents partis parti radical non à l initiative parti démocrate chrétien non union démocratique du centre non parti socialiste,1977
portefeuille sa décision n en a pas moins irrité le parti démocrate chrétien parce qu elle révélait le poids de la,1977
divergent d avec leur parti national à l image du parti démocrate chrétien seul le parti socialiste vaudois se trouve donc,1977
offensive déclarée de l association oui à la vie du parti démocrate chrétien surtout rien d annoncé non plus certains combattants,1977
en pratique la liberté de décision des femmes quant au parti démocrate chrétien il sait que la loi sera ratifiée si,1977
soutient pas le référendum berne ats le comité directeur du parti démocrate chrétien pdc suisse s est réuni samedi à berne,1977
suivants socialistes parti du travail parti radical parti libéral vigilance parti démocrate chrétien le rassemblement démocratique genevois l union hors parti,1977
plus faible qu au conseil national il s agit du parti démocrate chrétien pdc qui ne parvient à s assurer que,1977
no parti libéral sièges liste no vigilance sièges liste no parti démocrate chrétien sièges liste no rassemblement démocratique genevois n a,1977
perte de deux sièges toutefois les partis libéral radical et démocrate chrétien conservent la majorité au grand conseil a la suite,1977
renforce notre conviction c est la constatation que l électorat démocrate chrétien a voté plus à droite que la ligne actuelle,1977
tienne sociale conservatrice du parti représente de l électorat le parti démocrate chrétien qui n est pas majoritaire dans le bas,1977
majorisée comme toutes les structures de l etat par le parti démocrate chrétien la commission parlementaire d enquête chargée d élucider,1977
pour la liste à cinq l assemblée des délégués du parti crate chrétien a décidé jeudi soir par oui non et,1977
et demie de discussion parfois assez chaudes comme unique candidat démocrate chrétien au conseil d état sa,1977
daniel metzger alain berger raymond beyeler patrick blaser georges brera parti démocrate chrétien sièges sont élus guy fontanet robert tochon pierre,1977
entièrement différente quel contraste par exemple entre la performance du parti démocrate chrétien et celle des popistes qui sont comme on,1977
de vue plan directeur armée et charte sociale européenne le parti démocrate chrétien suisse pdc a senté vendredi à la presse,1977
passer de cinq à sept municipaux afin de donner au parti démocrate chrétien un siège qu il revendique depuis longtemps où,1977
vente chez bonnard et à l entrée manifestation d u parti démocrate chrétien mercredi novembre assemblée de quartier cafébrasserie de grancy,1977
candidat le mieux placé obtient suffrages groupement pour l environnement parti démocrate chrétien parti radical parti libéral parti ouvrier et populaire,1977
jean rodolphe hack michel strub lily brelaz robert liste no parti démocrate chrétien sont élus mugny roger barman armand ganière françois,1977
jean marie savoy henri delessert adrien genoud pierre may jean parti démocrate chrétien dutoit bernard delaloye gabriel pralong albert gilliéron jean,1977
assemblées législatives des communes suisses de plus de habitants le parti démocrate chrétien de sion n a pas à lui envier,1977
m kurt sovilla zh a été proposé par le groupe démocrate chrétien comme nouveau juge suppléant pour le tribunal fédéral la,1977
non adhésion de la suisse à l onu les groupes démocrate chrétien radical et socialiste ont accepté à l unanimité les,1977
nuancée dans le vaterland et d autres journaux proches du parti démocrate chrétien pierre aubert est une forte personnalité il a,1977
remplacement et l acceptation des mesures fédérales d économies le parti démocrate chrétien vaudois s est prononcé contre l impôt sur,1977
qu en regard de ce qu elle purrait coûter au parti démocrate chrétien lors de l élection du grand conseil en,1977
le pdc reprend sa liberté au nom d un groupe démocrate chrétien naturellement mécontent m ganière dénonça l accord intervenu entre,1977
moraux et religieux était attendu d autant plus que le parti démocrate chrétien était la seule formation d audience nationale à,1977
peur au peuple genevois s est il dit comme le parti démocrate chrétien dont on regrette qu il ait soutenu cette,1977
du pdc suisse en gare de lausanne le secrétariat du parti démocrate chrétien suisse nous écrit monsieur le rédacteur en chef,1977
expliquèrent les rapporteurs le socialiste bernois richard muller et le démocrate chrétien vaudois roger mugny en réponse à la proposition du,1977
détail continue aujourd hui certains comme le porte parole du parti démocrate chrétien m butty aimeraient plus d investissements et un,1977
lendemain des élections législatives de juin la collaboration entre le parti démocrate chrétien et le parti communiste n a cessé de,1977
paysans artisans et indépendants union démocratique du centre et le parti démocrate chrétien vaudois ont officiellement déposé vendredi à la chancellerie,1977
les organisations progressistes se sont prononcés contre ce quorum le parti démocrate chrétien le parti radical et le parti socialiste n,1978
le rédacteur en chef de die ostschweiz principal organe du parti démocrate chrétien en suisse orientale la mort d ezio canonica,1978
pdc pour une nouvelle tva berne ats le groupe parlementaire démocrate chrétien s est penché mercredi au cours de sa séance,1978
d etat en valais s identifie par trop avec le parti démocrate chrétien quant à m bondenmann député du k o,1978
mêmes les socialistes les républicains les socio démocrates mais le parti crate chrétien qui reste le plus fort a fait savoir,1978
atténué la vigueur des revendications les adversaires du gouvernement homogène démocrate chrétien ont cependant une position de repli d accord disent,1978
base anticommuniste du parti devant cette perspective les responsables du parti démocrate chrétien sont donc profondément divisés d autant plus que,1978
le dernier mot sera cependant le groupe de son propre parti démocrate chrétien c est lui qui décidera en dernière analyse,1978
succédant à lui même remanier son cabinet c est le parti démocrate chrétien profondément divisé qui doit en réalité affronter la,1978
elle arrive à rome après le veto exprimé par le parti démocrate chrétien a suscité de violentes réactions dans les partis,1978
les candidats du pdc lausannois xfimu pour sa part le parti démocrate chrétien lausannois a également désigné mercredi soir ses candidats,1978
de base soumis aux délégués berne ats les délégués du parti crate chrétien suisse pdc ne prendront pas seulement position sur,1978
consultations entreprises dans la direction du parti le groupe parlementaire démocrate chrétien des chambres fédérales et la commission programme de base,1978
on ne pouvait non plus faire trop large crédit au parti démocrate chrétien dont l aile gauche actuellement en progrès s,1978
le résultat d une consultation populaire précisément l organe du parti démocrate chrétien les neue zùrcher nachrichten se borne matin à,1978
indépendance hors de prix par philippe barraud la décision du parti démocrate chrétien vaudois de rompre avec l entente vaudoise n,1978
année la présidence du grand conseil devait revenir à un démocrate chrétien m armand barman on peut se demander si son,1978
des expériences que sait on actuellement un député membre du parti démocrate chrétien a déclaré notamment au cours d une intervention,1978
une large part les séquelles de l éviction d un démocrate chrétien lors des élections à l exécutif de lausanne sans,1978
partis réclamer hautement qu ils ont vocation centriste soit le parti démocrate chrétien et le parti radical c est frappant à,1978
vaudois à la fois à des divergences à droite le parti démocrate chrétien a quitté l entente vaudoise et laissé la,1978
celui de m jean françois bourgknecht le magistrat multimandataire du parti démocrate chrétien a largement perd u du crédit en refusant,1978
pdc et raphaël bossy pdc ainsi que séverin andrey pics parti indépendant chrétien social la répartition des sièges durant la législature,1978
projet constitutionnel sur la protection des consommateurs berne ats le parti démocrate chrétien suisse pdc rejette l introduction d une clause,1978
à l unanimité vendredi soir par le bureau directeur du parti démocrate chrétien il prévoit que la dc les communistes et,1978
revenir au pouvoir à lai tête d un nouveau gouvernement démocrate chrétien minoritaire et comprenant quelques technocrates apolitiques le programme de,1978
l ancien président de la république italienne m giuseppe saragat social démocrate estime qu on ne peut pas demander au parti,1978
peut pas demander au parti communiste de soutenir un gouvernement démocrate chrétien sans lui accorder en contrepartie une bilité sur un,1978
à la recherche du compromis principale arme de gouvernement du parti démocrate chrétien le comité directeur de celui ci a approuvé,1978
s engageront à appuyer au parlement le gouvernement probablement homogène démocrate chrétien qui devra le réaliser de plus une sorte de,1978
pris acte des décisions de l assemblée des délégués du parti démocrate chrétien réunis le janvier il s est réjoui de,1978
nous sommes bel et bien sortis de l entente le parti démocrate chrétien vaudois a réagi au communiqué du comité de,1978
fém prdl michel pittet avocat jacques rossier ingénieur pdc candidats parti démocrate chrétien roger mugny ancien municipal armand barman maître ébéniste,1978
vendredi février e n direct su r radio suisse romande parti démocrate chrétien h pai udc h parti socialiste h pop,1978
radicaux dont le syndic lucien nussbaumer socialistes et pics indépendant chrétien social cet énoncé est incomplet puisque trois conseillers pour chaque,1978
cnjoncturel ac partis suisses rn e avs age avs ac parti démocrate chrétien parti radical démocratique parti socialiste union démocratique du,1978
du travail ligue marxiste révolutionnaire union démocratique fédérale socialistes libéraux parti indépendant chrétien social lùcerne fribourg valais et parti fédéraliste européen,1978
renens michel reymond imprimeur prilly louis trachsel pensionné crissier pdc parti démocratique chrétien jean terrapon employé de banque crissier raphaël castella,1978
de trois socialistes trois pdc deux radicaux et un indépendant chrétien social la victoire de la gauche était généralement pronostiquée c,1978
acceptées décisions bientôt annulées par un refus plus général le démocrate chrétien egli de lucerne a demandé la suppression de l,1978
waridel ménagère m louis mesot ouvrier tous à vevey pdc parti démocrate chrétien mme nicole keller député sortant vevey mme cécile,1978
j cqnseiller communal vice président du parti libéral montreusien pdc parti démocrate chrétien m joseph ponti té sortant montreux mme livia,1978
victor ruffy géographe morrens philippe henry instituteur poliez le grand parti démocrate chrétien mm maurice schmidt notaire député sortant poliez le,1978
notaire valaisan qui se trouve être un membre influent du parti démocrate chrétien en l occurrence m joseph blatter lequel il,1978
ainsi que l oberwalliser volksfreund théoriquement l organe du groupe chrétien social du haut valais auquel appartient m hans wyer ancien,1978
du gouvernement dans le limogeage politique de m niklaus le parti démocrate chrétien national qu il préside toujours ne met il,1978
â la perte communiste le quatrième parti du parlement le parti démocrate chrétien fait jourd hui triste figure qui ne conserve,1978
qu on en arriva à la séance de vendredi le parti majoritaire démocrate chrétien par m pierre moren décida de suivre,1978
l enlèvement jeudi matin de m aldo moro président du parti démocrate chrétien un dispositif policier d une ampleur impressionnante a,1978
paysans artisans et indépendants pai udc avec l appui du parti démocrate chrétien pour l élection des municipalités par le peuple,1978
l année en cours agé de ans il représente le parti démocrate chrétien au gouvernement depuis ats,1978
le parti démo chrétien italien décide de tout faire pour sauver aldo,1978
est la décision prise samedi soir par la direction du parti démocrate chrétien après le message des brigades rouges qui annonçait,1978
à l intransigeance du gouvernement qui encouragé notamment par le parti démocrate chrétien et le parti communiste a refusé jusqu ici,1978
précédents réitère les attaques contenues dans ceux ci contre le parti démocrate chrétien et ses gouvernements successifs le communiqué affirme que,1978
pas céder au chantage des brigades rouges la direction du parti démocrate chrétien a affirmé que toutes les possibilités devraient être,1978
président depuis un mois en effet il popolo organe du parti démocrate chrétien presse lundi les brigades rouges d épargner m,1978
de la commission parlementaire le socialiste schwytzois reiniger et le démocrate chrétien tessinois pedrazzini en furent les auteurs ce dernier souligna,1978
d autoriser une centrale en évaluant le besoin et le démocrate chrétien biberbost partisan au contraire de laisser cette compétence au,1978
de rome ce communiqué dont l authenticité selon un porteparole démocrate chrétien a été établie a fait passer au second plan,1978
texte aujourd hui avril prend fin la période dictatoriale du parti démocrate chrétien qui pendant plus de trois décennies a été,1978
annonçons à cette date que l exécution du président du parti démocrate chrétien a eu lieu par suicide nous permettons la,1978
après midi par m flaminio piccoli président du groupe parlementaire démocrate chrétien m piccoli a simplement ajouté que le message des,1978
que la vraie épreuve commence pour le gouvernement et le parti démocrate chrétien de rome jean lucquois l ultimatum est moins,1978
humanitaires et c est là que le gouvernement et le parti démocrate chrétien qui s identifie imprudemment de plus en plus,1978
se trouvent depuis l ultimatum dans une terrible impasse le parti démocrate chrétien et moins explicitement cependant le gouvernement avaient dès,1978
parlerait jamais aux terroristes les partisans de la négociation au parti crate chrétien et au gouvernement ne sont cependant pas isolés,1978
moro le mars à turin m giovanni picco ancien maire démocrate chrétien était atteint aux jambes de plusieurs coups de feu,1978
à son secrétaire et homme de confiance au leader du parti démocrate chrétien de rome jean lucquois agit il uniquement sous,1978
bari une inscription poignante figure au fronton du siège du parti démocrate chrétien aldo nous sommes avec toi offre panaméenne le,1978
écoles et le non aux douze dimanches sans voiture le parti démocrate chrétien vaudois accepte l heure d été le tarif,1978
nommé le mai le présent bureau qui comprend rappelons le démocrate chrétien lâchât président son collègue de parti pierre paupe le,1978
le socialiste roland béguelin le radical antoine artho et le chrétien social gabriel roy doit donc passer le feu de la,1978
que le choix ne sera pas aisé au sein du parti démocrate chrétien en revanche on n a pas connaissance d,1978
suivante union démocratique du centre parti socialiste parti radical démocratique parti démocrate chrétien parti populaire évangélique jeune berne alliance des indépendants,1978
action nationale parti libéral radical de l unité jurassienne inchangé parti chrétien social indépendant inchangé unité jurassienne organisations progressistes de suisse,1978
m moro du fond de sa prison au secrétaire du parti démocrate chrétien analyse qui en revient elle aussi à expliquer,1978
sort de m moro depuis que le gouvernement et le parti démocrate chrétien ont annoncé qu il n était pas question,1978
des indications réunis vendredi soir à berne les délégués du parti démocrate chrétien suisse ont décidé par voix contre et absentations,1978
de paix mais les libéraux ont constate que si le parti démocrate chrétien la soutenait par exemple c était afin de,1978
le pdc divisé à propos de l indication sociale le parti démocrate chrétien suisse a tranché de la quintuple votation fédérale,1978
à l italie er ats afp reuter les dirigeants du parti démocrate chrétien doivent se réunir lundi soir pour discuter des,1978
mais cela personne parmi ceux qui veulent sauver le leader démocrate chrétien ne songe à le demander ni à l obtenir,1978
lundi président du grand conseil valaisan m ferrez appartient au parti démocrate chrétien il est probablement le seul président d un,1978
du vieil immeuble où siégeait justement le comité directeur du parti démocrate chrétien le lieu et le temps ont donc été,1978
conseiller fédéral hans hiierlimann mardi soir devant les délégués du parti démocrate chrétien lucernois la loi fédérale sur l aide aux,1978
n a obtenu que voix sur votants le nouveau représentant démocrate chrétien m bernard beuret en a réuni aussi le chrétien,1978
démocrate chrétien m bernard beuret en a réuni aussi le chrétien social gabriel roy réunissant les suffrages nécessaires à sa réélection,1978
son tour voix soit plus que le socialiste girardin le chrétien social montavon et le démocratechrétien jodry banque cantonale le projet,1978
journaux de mercredi considèrent comme un trait polémique contre le parti démocrate chrétien elle disait notamment je prie pour tous ceux,1978
à laquelle la captivité d aldo moro avait soumis le parti démocrate chrétien celuici a été la principale cible des attaques,1978
comité d organisation le député marcel bourquenez rappelle que le parti démocrate chrétien petit parti d opposition dans le canton de,1978
lâchât président de l assemblée constituante jurassienne et lui aussi démocrate chrétien il affirme que c est bien moins la question,1978
été élus au tribunal cantonal m heinrich blesi de glaris démocrate chrétien antérieurement juge au tribunal civil et la socialiste johanna,1978
un déficit excessif les positions demeurent floues sauf celle du parti démocrate chrétien qui préfère songer au succès du plan qu,1978
de quelques grandes associations heure d été parti radical oui parti démocrate chrétien oui jeunes libre parti socialiste libre union démocratique,1978
oui oui non non non vigilance action nationale nina romand parti chrétien social indép union syndicale suisse conf des syndicats chrétiens,1978
avant touçsurdes questions d administration interne du jourtial officiel du parti démocrate chrétien jurassien malgré cette ombre le pdc a fêté,1978
à part dans les campagnes où la vieille garde du parti démocrate chrétien par patriotisme avant tout reste fidèle à celui,1978
with et dirige la section arboriculture de waedenswil membre du parti démocrate chrétien il a été préféré de justesse voix contre,1978
démocrates européens viceprésidente suisse selon un communiqué publié par le parti démocrate chrétien suisse la bâloise gertrude spiess conseillère nationale a,1978
dénoncer l accord conclu en avec les partis radical et démocrate chrétien constitue l événement marquant du week end au tessin,1978
forces démocratiques de son côté m alberto stefani président du parti démocrate chrétien tessinois dans une déclaration faite vendredi soir à,1978
autre réactions du pdc et du psa le comité du parti démocrate chrétien pdc tessinois et le bureau politique du parti,1978
qui l a suivie exemplaire a dit d elle le parti démocrate chrétien auquel appartient le président démissionnaire nécessaire a renchéri,1978
leurs traditionnelles excursions en train puis en bateau le groupe démocrate chrétien pdc s est rendu via lucerne et brunnen à,1978
où elles sont transformées en engrais ats tessin congrès du parti démocrate chrétien un millier de délégués et membres du parti,1978
parti démocrate chrétien un millier de délégués et membres du parti démocrate chrétien du tessin se sont réunis samedi à lugano,1978
ville bâle campagne ou soleure de delémont victor giordano le parti démocrate chrétien des suffrages en avril dernier avait donné un,1978
sa situation mais il ne reçut pas l aval du parti démocrate chrétien pour sa diffusion et fut pris de court,1978
chef et sans consulter personne d où le veto du parti démocrate chrétien qui acceptait un candidat socialiste ou laïque mais,1978
années il a exercé d importantes responsabilités au sein du parti démocrate chrétien auquel il appartient toujours,1978
ats jura soutien a jean wilhelm une assemblée extraordinaire du parti démocrate chrétien d ajoie réunie en présence de quelque personnes,1978
allocations familiales l avis du pdc de son côté le parti démocrate chrétien suisse estime juste dans l ensemble le projet,1978
se représenteront pas les deux conseillers aux etats argoviens le démocrate chrétien robert reimann et le radical willi urech ont décidé,1978
qui comme le parti socialiste l alliance des indépendants le parti démocrate chrétien la fédération des eglises protestantes ou la conférence,1978
opposer aux deux partis historiques les libéraux radicaux et le parti démocrate chrétien pdc si ce front devait voir le jour,1978
le siège socialiste modéré que de conquérir le deuxième siège démocrate chrétien qui est de coutume attribué non par un quotient,1978
accord qui le liait depuis au parti radical et au parti démocrate chrétien interrogés par la radio tessinoise les responsables des,1978
la délégation du conseil fédéral pour la question jurassienne le parti démocrate chrétien s est déclaré convaincu qu en refusant au,1978
la confédération ils en gagnent ailleurs assurance maternité enfin le parti démocrate chrétien a annoncé son soutien à la pétition des,1978
résiliations du contrat de travail une motion du groupe parlementaire démocrate chrétien a d ores et déjà été déposée par le,1978
absolue election de l assemblée constituante mars à i pdc parti démocrate chrétien plr parti libéral radical d r narti aor,1978
parti libéral radical d r narti aor iflliete pdc pcsi parti chrétien social indépendant udc union démocratique du centre prr parti,1978
est faite de deux principaux mouvements socialiste d une part chrétien social indépendant de l autre radicaux et démocrates du centre,1978
eut à élire son bureau françois lâchât fut le candidat démocrate chrétien tout désigné à la présidence il était vice président,1978
l aucun parti ne domine la scène politique jurassienne le parti démocrate chrétien auquel j appartiens représente environ pour cent de,1978
de l èlectorat le parti radical le parti socialiste le parti chrétien social indépendant l union démocratique du centre les radicaux,1978
presse et l école le parti conservateurcatholique devenu aujourd hui démocrate chrétien conserva une majorité absolue au grand conseil jusqu en,1978
le pdc entre au conseil communal d yverdon le parti démocrate chrétien occupe pour la première fois depuis jeudi soir,1978
m albert lavanchy libéral décédé aux élections communales de le parti démocrate chrétien avait tenté sa chance sous ses propres couleurs,1978
de la tva alors que le parti radical et le parti démocrate chrétien souhaitent que la réforme des finances fédérales soit,1978
sur neuf se sont abstenus les arbitres du débat le parti démocrate chrétien ainsi que dans une certaine mesure l union,1978
chrétienne mme moro a toujours protesté en effet contre le parti démocrate chrétien qui disait elle n avait rien fait pour,1978
voie ni capitalisme d etat et dictature soviétique ni réformisme social démocrate qui ne sait que servir le système capitaliste le,1978
telle n est pas l opinion des principaux leaders du parti démocrate chrétien ils pensent au contraire et ils l ont,1978
jura mots d ordre des partis et organisations partis nationaux parti démocrate chrétien pdc oui parti radical démocratique prds oui parti,1978
parti fédéraliste européen oui organisations progressistes de suisse poch oui parti chrétien social indépendant pcsi lu fr vs jura oui organisations,1978
