Sentence,Year
propos du droit à la vie cher aux catholiques du parti démocrate chrétien il citera saint thomas d aquin qui fixe,1975
en fuite le commandant josé sanches osorio secrétaire général du parti démocrate chrétien pdc et ancien ministre de la communication sociale,1975
suppression du parti démocrate chrétien portugais notre pdc proteste berne ats le parti,1975
parti démocrate chrétien portugais notre pdc proteste berne ats le parti démocrate chrétien suisse proteste contre la suppression du parti mocrate,1975
démocrate chrétien suisse proteste contre la suppression du parti mocrate chrétien et d autres partis portugais suppression qui constitue à ses,1975
à gauche du parti radical de l udc et du parti démocrate chrétien tandis qu une forte proportion des autres électeurs,1975
la consultation électorale du avril en même temps que le parti démocrate chrétien,1975
fut de ne pas avoir donné de l argent au parti démocrate chrétien si je l avais fait je n aurais,1975
congrès du parti démocrate chrétien à locarno les délégués ont misé sur la,1975
locarno ats dimanche matin s est terminé le congrès du parti démocrate chrétien à locarno congrès auquel ont assisté environ cent,1975
a la fin de la séance plénière des délégués du parti démocrate chrétien le conseiller fédéral kurt furgler a prononcé une,1975
jusqu à maintenant radicaux udc union démocratique du centre pdc démocrate chrétien et socialiste,1975
m argante righetti radical sortant avec voix m flavio cotti démocrate chrétien nouveau avec voix m fabio vassalli démocrate chrétien nouveau,1975
centre qui est une conjonction des partis campagnards traditionnels un démocrate chrétien un socialiste deux radicaux deux radicaux c est là,1975
deux chacun est désormais deux fols plus puissant que le parti démocrate chrétien classé troisième avec douze mandats comme en en,1975
etat interviendra à l occasion d une prochaine séance le parti démocrate chrétien revendique une plus grande responsabilité au sein du,1975
a berne ofc wfcfck tin u a fcifcknt congrès du parti démocrate chrétien n non le juin signerait la mort de,1975
absolument tout ce que nous lui proposions albin breitenmoser est démocrate chrétien devant les délégués du parti suisse samedi à berne,1975
le décembre de berne pierre andré stauffer albin breitenmoser est démocrate chrétien mais avant tout il est bâlois il représente un,1975
intérêt des régions défavorisées du pays des régions où le parti démocrate chrétien est souvent pour ne pas dire toujours fortement,1975
conseiller d etat du canton du valais secrétaire général du parti démocrate chrétien valaisan directeur honoraire de l office international des,1975
un représentant au législatif de la ville de lucerne le parti crate chrétien pdc semble assuré des douze sièges qu il,1975
des douze sièges qu il avait jusqu ici et le parti chrétien social conserve également son unique mandat au parlement pour,1975
établit comme suit libéraux pdc sans changement soc ail ind parti chrétien social sans changement poch la répartition des sièges restants,1975
propose également de voter cinq fois oui le comité du parti démocrate chrétien vaudois se prononce lui aussi en faveur des,1975
déclaré dimanche soir le conseiller national hans wyer président du parti démocrate chrétien de suisse et co président du mité d,1975
en matière introduit par un exposé approfondi du rapporteur le démocrate chrétien uranais muheim le radical zurichois honnegger souligna la difficulté,1975
perdu ce paquet de mesures dit le fribourgeois dreyer du parti démocrate chrétien doit être compris comme un calmant non pas,1975
a été désigné en la personne de m rené emmenegger démocrate chrétien l exécutif de la ville est formé de cinq,1975
un nouveau juge cantonal le candidat officiel et unique du parti démocrate chrétien parti majoritaire me roger lovey secrétaire général de,1975
liste des partis italiens bénéficiaires des contributions d exxon le parti démocrate chrétien le parti républicain le parti socialiste et le,1975
fanfani dimanche la seconde journée du conseil national extraordinaire du parti démocrate chrétien a vu le dernier allié de m fanfani,1975
démissionne rome reuter mis en minorité au conseil national du parti démocrate chrétien m amintore fanfani qui domine depuis vingt ans,1975
heure a été élu au poste de secrétaire général du parti démocrate chrétien italien vacant à la suite du départ de,1975
pdc en définitive du fait du caractère nettement confessionnel du parti démocrate chrétien les différences entre lui et le parti radical,1975
et confirmée par l intéressé lui même en effet le parti chrétien social de loeche a décidé de renoncer à présenter,1975
en japonais une semblable configuration politique la prééminence absolue du parti démocrate chrétien et les problèmes identiques ceux inhérents à toutes,1975
elle profitera plutôt au parti radical au pai ou au parti démocrate chrétien qu au pop et c est bien ce,1975
du délai actuellement l avortement divise le pays en trois parti démocrate chrétien l eglise catholique les cantons de suisse centrale,1975
et populaire candidats du parti socialiste du parti libéral du parti démocrate chrétien de l alliance des indépendants cumulés du parti,1975
des journaux tels que il popolo or ne officiel du parti démocrate chrétien circonstance aggravante la sanction a été décidée quelques,1975
sa stratégie face aux communistes romes afp la direction du parti démocrate chrétien a achevé ses travaux dans la nuit de,1975
tagblatt paraît le matin coire ats le buendner tagblatt proche parti démocrate chrétien a paru pour la première fois le matin,1975
présence des conseillers fédéraux furgler et huerlimann les délégués du parti démocrate chrétien réunis samedi à baden se sont prononcés en,1975
n était jamais tombé aussi bas autre chute celle du parti crate chrétien dont la participation à l électorat s est,1975
sièges trois conseil des etats au conseil des etats le parti démocrate chrétien est le plus puissant de tous les groupes,1975
au conseil national les socialistes partent seuls au combat le parti indépendant chrétien social qui n est pas en lice cette,1975
glasson exige une vaste percée socialiste dans l électorat indépendant chrétien social elle exige aussi que les suffra ges socialistes ou,1975
s est affirmée comme s est confirmée la puissance du parti démocrate chrétien en pays de fribourg qu on avait crue,1975
d éclat socialiste aux dernières élections cantonales le troisième député démocrate chrétien le singinois franz hayoz s est retiré de la,1975
attentat commis lundi soir à rome contre bernardo lighton leader démocrate chrétien chilien a pu être décidé à santiago et exécuté,1975
les policiers romains estiment mardi que bernardo leighton fondateur du parti démocrate chrétien chilien dont il représente l aile gauche gié,1975
qui représente aujourd hui au conseil national en compagnie du démocrate chrétien jean wilhelm le mouvement autonomiste jurassien en pierre gassmann,1975
sièges reviendra à la formation nordiste la plus puissante le parti démocrate chrétien le second à celle des trois listes restantes,1975
il est menacé sur sa propre liste par un jeune démocrate chrétien aux dents longues françois lâchât m simon kohler menacé,1975
un candidat du poch à affronter marco hartmann ans le parti démocrate chrétien est le plus puissant du canton puissance qui,1975
rhodes intérieures d appenzell un seul homme en lice le démocrate chrétien arnold koller il n y a pas d élection,1975
non parent du conseiller fédéral hans huerlimann président du groupe démocrate chrétien à la chambre du peuple aloïs huerlimann n a,1975
othmar andermatt et markus kundig le premier radical le second démocrate chrétien ne participeront pas aux élections du octobre elus tacitement,1975
conseil national sur les neuf cinq sont occupés par le parti démocrate chrétien trois par les radicaux quoique les radicaux de,1975
élection au conseil des etats tout est déjà réglé le démocrate chrétien f xaver leu sera remplacé avec l accord de,1975
avec l accord de tout le monde par l avocat démocrate chrétien alphons egli le radical peter knusel sera remplacé par,1975
dernière année a renoncé à un nouveau mandat au candidat démocrate chrétien aloïs dobler député au grand conseil les radicaux opposent,1975
unique siège du conseil national détenu aujourd hui par le démocrate chrétien august albrecht membre du conseil d administration de buhrle,1975
menacer les radicaux riches déjà de deux sièges indiscutés le parti démocrate chrétien n était pas très loin du troisième mandat,1975
des etats les deux titulaires qui appartiennent l un au parti démocrate chrétien l autre au parti démocrate rallié aux agrariens,1975
autre on favorise le candidat de la socialiste et communiste parti démocrate chrétien le président roger mugny conseiller national parti libéral,1975
libéraux et radicaux sans changement représentants du parti du travail démocrate chrétien et vigilant vigilance doit son siège à l apparentement,1975
libéral radical joachim weber qui se retirait c est le démocrate chrétien josef risi né en vétérinaire agriculteur d arth qui,1975
etat a été élu avec voix et m odilo guntern chrétien social du haut valais avec voix m françois couchepin rad,1975
altdorf a obtenu voix les deux élus sont membres du parti démocrate chrétien ils sont tous deux membres de la chambre,1975
v schwytz participation ce sont de nouveau deux représentants du parti démo chrétien qui représenteront le canton de schwytz au conseil,1975
s établit de la vante parti socialiste parti radical parti démocrate chrétien union démocratique du centre alliance des indépendants union libérale,1975
argovie qui aura lieu le décembre le comité élargi du parti démocrate chrétien du district d aarau a décidé de proposer,1975
hunziker rad et léo weber pdc selon un communiqué du parti démocrate chrétien argovien la candidature de m brunschwiler constitue une,1975
du renouvellement du collège gouvernemental centre dynamique le vaterland organe démocrate chrétien de la suisse centrale entend préciser la position du,1975
l importation et l exportation de produits agricoles transformés l parti démocrate chrétien valaisan avait été la seule formation politique à,1975
l eau sion ats m pierre moren vice président du parti démocrate chrétien valaisan a constaté dimanche soir avec satisfaction que,1975
assurance trois partis le pdc le parti socialiste et le parti indépendant chrétien social soutenaient la loi le parti radical s,1975
en ainsi le parti radical démocratique suisse obtient o le parti démocrate chrétien suisse le parti socialiste suisse union démocratique du,1975
les deux candidats officiels du parti radical et du parti démocrate chrétien d argovie ont été élus ce week end,1975
joerg huber avocat à zurzach le troisième candidat le député démocrate chrétien karl gisler maire de stilli qui a présenté sa,1975
les obsèques de l ancien secrétaire général du parti démocrate chrétien et rédacteur parlementaire du vaterland le quotidien lucernois,1976
est à dire d une cogestion des affaires par le parti démocrate chrétien et des communistes a obligé ces derniers à,1976
un gouvernement aussi ouvert aux influences communistes le comité directeur démocrate chrétien qui siège jeudi sera houleux les incertitudes et les,1976
de ce fait le courrier quotidien d opinion proche du parti démocrate chrétien genevois se trouve dans l impossibilité de paraître,1976
bâlois bâle ats a l occasion d une assemblée le parti démocrate chrétien de bâle ville a décidé de proposer la,1976
que l initiative lancée sur le plan fribourgeois par le parti démocrate chrétien en déjà garde toute sa valeur dans ses,1976
domaine de l assurance maladie autre initiative celle du pics parti indépendant chrétien social visant à la généralisation du versement des,1976
que les hommes qui sont actuellement à la tête du parti démocrate chrétien mm zaccagnini et moro représentent une garantie pour,1976
des communistes du juin dernier pourraient ramener vers le centre démocrate chrétien les électeurs égarés à l extrême gauche c est,1976
la création d un etat social au printemps dernier le parti chrétien social indépendant pcsi du jura avait formé une commission,1976
la preuve que le pcsi entend se distancer nettement du parti démocrate chrétien dont il est issu pour devenir l une,1976
la création d un etat social au printemps dernier le parti chrétien social indépendant pcsi du jura avait formé une commission,1976
la preuve que le pcsi entend se distancer nettement du parti démocrate chrétien dont il est issu pour devenir l une,1976
un accord de législature les trois partis gouvernementaux tessinois radical démocrate chrétien socialiste sont parvenus à un accord sur un programme,1976
par un remaniement départemental qui attribue plus de responsabilités au parti démo chrétien par la création d un département de l,1976
élections ce parti avait renforcé sa position par rapport au parti démocrate chrétien le remaniement départemental reste toutefois une solution imparfaite,1976
revient aux tribunaux de se prononcer sur le sort du parti démocrate chrétien pdc dont certains réclament la dissolution le qualifiant,1976
vue de ramener au pouvoir une odieuse dictature fasciste le parti démocrate chrétien s était vu interdire la participation aux élections,1976
assemblée des délégués du parti démocrate chrétien deux fois non à la participation et rejet,1976
soutenaient l initiative syndicale sur la participation es délégués du parti démocrate chrétien suisse réunis en assemblée samedi matin à berne,1976
partenaires sociaux maintenir une position de centre dynamique si le parti démocrate chrétien désire garder intacte sa crédibilité maintenir sa position,1976
de l article ter de la constitution sur lequel le parti démocrate chrétien pa r exemple fonderait une nouvelle loi comme,1976
des dangers du contre projet parlementaire au récent congrès du parti démocrate chrétien suisse ceux des adversaires du contre projet qui,1976
prononcé à mité contre l initiative syndicale partis radical et démocrate chrétien vaudois non à l initiative et au contre projet,1976
des votations fédérales du mars est également recommandé par le parti démocrate chrétien vaudois et par la chambre vaudoise d agriculture,1976
est aussi recommandé par de tout autres milieux comme le parti démocrate chrétien qui considère que le contre projet est non,1976
max aebischer conseiller d etat a informé la direction du parti démocrate chrétien fribourgeois qu il ne sollicitera pas un renouvellement,1976
surtout due à l attitude du parti socialiste et du parti démocrate chrétien les partis politiques reprennent leur indépendance le rj,1976
et modérées enfin la gauche sera formée des élus du parti chrétien social indépendant du parti socialiste et du pop quoique,1976
par le gouvernement italien les syndicats cgil majorité communiste cisl démocrate chrétien et uil social démocrate républicain réunis jeudi matin à,1976
historique rome reuter il n est pas question pour le parti démocrate chrétien de former une alliance gouvernementale avec les communistes,1976
entendue il y a un vainqueur et c est le parti démocrate chrétien qui avait pris ses distances face à l,1976
la sité de ne point laisser dormir la question le parti démocrate chrétien a montré le chemin le rédacteur en chef,1976
il convient sans nul doute de souligner le score du parti démocrate chrétien lequel a épousé très étroitement la cause l,1976
une sensible poussée à gauche avance des partis socialiste et chrétien social indépendant tassement démocrate chrétien recul radical l union démocratique,1976
élus à l ex i ception de m adrien schaffner chrétien social in dépendant me andré cattin député ancien prési dent,1976
communaux sur cent alors qu le parti libéral et le parti démocrate chrétien s octroyaient un municipal chacun avec douze et,1976
du conseil fédéral ou de celle qu a défendue le parti démocrate chrétien on aurait ainsi quelque citoyens pour approuver aussi,1976
démocratie chrétienne l emporte au parlement rome er afp le parti démocrate chrétien a brisé le front avec le parti socialiste,1976
sur un amendement restrictif du projet de loi l amendement démocrate chrétien n autorise l avortement qu en cas de viol,1976
renforcer le bloc formé par le parti socialiste et le parti démocrate chrétien ce déplacement politique est la conséquence des discussions,1976
eu vendredi matin à rame avec le secrétaire général du parti démocrate chrétien m benigno zaccagnini m berlinguer a précisé que,1976
sur la nouvelle organisation indique le service de presse du parti démocrate chrétien bien qu il estime urgente la création d,1976
constituante jurassienne propositions du parti démocrate chrétien saignelégier ats les députés tes chrétiens à l,1976
la collaboration des experts nécessaires d autre part le groupe démocrate chrétien pense qu il est souhaitable de créer de nouvelles,1976
roblès fils commentant au nom de la fédération populaire démocratique démocrate chrétien les premiers résultats des élections au portugal se félicite,1976
chrétien social et indépendant valais création d un nouveau parti dissidence,1976
personnes étaient réunies jeudi soir à sion pour fonder le parti tien social indépendant valaisan il s agit là indiscutablement d,1976
aux côtés des députés du c mouvement social indépendant le parti tien social indépendant sera affilié au mouvement chrétien sosial indépendant,1976
à une forte majorité se sont prononcés les délégués du parti démocrate chrétien mais si le congrès a exprimé un avis,1976
de se présenter aux élections législatives sur les listes du parti démocrate chrétien dans une interview au quotidien de turin la,1976
avec les communistes rome reuter m benigno zaccagnlnl secrétaire du parti démocrate chrétien a nettement écarté la possibilité jeudi que ce,1976
du théâtre local un professeur gauchiste un curé progressiste un social démocrate qui fut hué une journaliste danoise sa collègue suédoise,1976
micheloud est agent immobilier à sion il est membre du parti démocrate chrétien nous l avons rencontré à genève en compagnie,1976
ats sous le titre la participation remise en chantier le parti démocrate chrétien suisse publie dans son dernier service de presse,1976
pouvoir les faiblesses des chefs les discordes intestines le vieux parti démocrate chrétien apparaît aux yeux de tous comme le seul,1976
toujours aux communistes mais le jour où la direction du parti démocrate chrétien a décidé d aller aux élections on a,1976
principes lui qui s est porté sur les listes du parti démocrate chrétien voici leur raisonnement les victoires syndicales qui se,1976
fort berne ats le comité directeur et le comité du parti démocrate chrétien suisses pdc se sont réunis vendredi à berne,1976
octobre prochain ce nouveau débat a été proposé par le parti démocrate chrétien qui a invité tous les partis gouvernementaux à,1976
les télex le parti socialiste répondra à l invitation du parti démocrate chrétien adressée également au parti radical et à l,1976
incompatibilité n a pas été retenue les groupes radical et démocrate chrétien y étant opposés toutefois seuls deux des membres du,1976
conseil général soit le parti socialiste le parti radical le parti démocrate chrétien le parti évangélique et le jeune berne ont,1976
le décembre prochain bienne ats a bienne les délégués du parti démocrate chrétien suisse pdc ont dit non à l initiative,1976
des prix et un oui arrêté sur le crédit le parti démocrate chrétien vaudois lui recommande un non heures et deux,1976
à dire quant au vaterland il approuve les délégués du parti démocrate chrétien de proposer au peuple le rejet de l,1976
fribourg ats m rémi brodard conseiller d etat sortant du parti démocrate chrétien fribourgeois est le seul des dix candidats aux,1976
électoral des deux dlistricts dans la gruyère m robert menoud démocrate chrétien a été confirmé pour un nouveau mandat par voix,1976
m bernard verdon socialiste dans la broyé m georges guisolan démocrate chrétien a également obtenu un nouveau mandat par voix contre,1976
des partis gouvernementaux berne ats les délégations des partis gouvernementaux parti démocrate chrétien parti radicaldémocratique parti socialiste union démocratique du centre,1976
bodenmann fils de pex conseiller aux etats hermann bodermann un démocrate chrétien si jamais il en fut a été élu conseiller,1976
années parti socialiste sièges parti radical démocratique union libérale démocratique parti démocrate chrétien parti évangélique poch jeunes libéraux libéraux socialistes sept,1976
wemen penig à brigue pdc ancien voix bloetzeij à viège chrétien social nouveau voix rogent udriot à saint maurice pdc ancien,1976
avec voix contre à m siegfried jur len ancien président chrétien social le pdc enlève également la vice présidence dé zermatt,1976
du conseil national était très serrée entre m peter bloetzer chrétien social et m ignaz mengis pdc l élu m bloetzer,1976
un siège aux radicaux à monthey dans l ensemble le parti démocrate chrétien a gagné six sièges au moins dans les,1976
dernier et traditionnel acte le président du conseil national le démocrate chrétien valalsan hans wyer remercie tous ceux qui ont contribué,1976
de loi sur l avortement auquel l eglise et le parti démocrate chrétien s étaient vigoureusement opposés avant d avoir force,1977
rumor ancien président du conseil un des grands notables du parti démocrate chrétien acquittement obtenu de justesse dix membres de la,1977
est coupable dix le jugent innocent la voix du président démocrate chrétien qui compte double a tranché en faveur de l,1977
a tranché en faveur de l acquittement l autre ministre démocrate chrétien m luigi gui est déclaré passible de jugement par,1977
passible de jugement par onze voix contre neuf le ministre social démocrate mario tanassî est lui renvoyé devant le parlement par,1977
de défendre leurs compagnons de parti m tanassi seul ministre social démocrate le plus durement atteint a fait remarquer amèrement que,1977
chrétiens sociaux il y avait en dans cette région un parti démocrate du district de conches dans le district de brigue,1977
ses rangs le fils d un ancien conseiller aux etats démocrate chrétien il édite son propre journal h y a quatre,1977
les neue zuercher nachrichten et die ostschweiz deux organes du parti démocrate chrétien écrivent à ce même propos c les raisons,1977
adressée au président du groupe pdc l assemblée nationale le parti démocrate chrétien du canton de schwyz propose mme elisabeth blunschy,1977
les délégués du parti démocrate chrétien disent un oui massif aux projets fiscaux réunis,1977
du national revue de la pressé alémanique les délégués du parti démocrate chrétien se sont prononcés massivement dimanche dernier en faveur,1977
projet constitutionnel le vaterland conclut pour toutes ces raisons le parti crate chrétien entend bien assumer se s responsabilités en vue,1977
en ruine rencontre berlinguer zaccagnini de rome jean lucquois le parti démocrate chrétien a entamé une négociation délicate avec les autres,1977
en revanche lors de sa récente assemblée des délégués le parti démocrate chrétien vaudois s est prononcé en faveur de la,1977
c est ainsi que lès quatre partis gouver nementaux radical démocrate chrétien socialiste et udc sont tous unanimes pour recommander le,1977
élections au conseil d etat de cet automne né en démocrate chrétien député de à m jean babel a été e,1977
gouvernementaux soit mm hans wyer conseiller d etat pour le parti démocrate chrétien fritz honegger conseiller aux etats pour le parti,1977
alliances plus ou moins loyales et honnêtes entre le gros parti crate chrétien et les maigres partis laïcs a l exception,1977
jeu les partis laïcs refusent une nouvelle collaboration avec le parti démocrate chrétien mais ils ne peuvent offrir au parlement une,1977
affaire du crédit suisse en moins de vingt ans le parti crate chrétien tessinois a perdu trois conseillers d etat tous,1977
le scandale vassalli a jeté un lourd discrédit sur le parti démocrate chrétien la direction du parti qui a mis dans,1977
chose même si c est loin d être toujours parfait parti démocrate chrétien c est un parti minuscule mais qui est,1977
ce qui n est a dit m zaccagnini secrétaire du parti démocrate chrétien qu une entente imposée par l état de,1977
une grosse machine bureaucratique dont les partis et surtout le parti crate chrétien se servent pour caser leurs hommes et assurer,1977
avocat et ami personnel de m moro le président du parti démocrate chrétien m moro n aurait il pas au moins,1977
président de l eni doit être un ami du leader démocrate chrétien qu au moins on en choisisse un plus compétent,1977
moyennes indépendants ope à l exception de l anmna du parti démocrate chrétien et du parti socialiste a l opposé les,1977
