Sentence,Year
de bâle a weinfeldên une réunion publique convoquée par le parti radical démocratique du canton de thurgovie orateurs conseiller aux etats,1945
perdra un avec la prochaine législature l assemblée générale du parti radical démocratique tenue dimanche sous la présidence de m faucherre,1945
liste socialiste un de plus tandis qu à viège le parti radical démocratique comptera désormais i représentants au lieu de au,1945
a brigue les socialistes gagnent un siège au détriment du parti radical la municipalité conservatrice de saint gingolph est renversée au,1945
du citoyen fauquex frédéric conseiller national riex une liste du parti radical démocratique vaudois portant le nom du citoyen dénéréaz da,1945
du canton est en jeu umaaio hs ur ï r parti radical démocratique lausannois mouvement des classes moyennes parti libéral démocratique,1945
parti radical démocratique lausannois mouvement des classes moyennes parti libéral démocratique lausannois,1945
benz de rorschach à fait savoir au comité cantonal du parti radical démocratique du canton de st gall sa décision définitive,1945
une invitation des autorités communales lausannoises et du comité du parti radical démocratique ont fêté selon la tradition l élection d,1945
dit il à m chuard n est pas celle du parti radical mais celte du grand conseil tout entier m lucien,1945
département militaire fédéral a prononcé un discours au congrès du parti radical démocratique suisse dans lequel il a dit entre autres,1945
discours qu il a noncé devant assemblée des délégués du parti radical démocratique suisse dimanche à zurich au palai des congrès,1945
concernant des ouvrages militaires actuellement en cours dans le canton parti radical vaudois le comité central élargi du parti radical démocratique,1945
parti radical vaudois le comité central élargi du parti radical démocratique vaudois s est réuni samedi après midi à lausanne sous,1945
conseil d etat y chez les radicaux le congrès du parti radical démocratique vaudois réuni samedi après midi sous la présidence,1945
département politique fédéral prenant la parole dimanche au congrès du parti radical démocratique suisse m le conseiller fédéral petitpierre a tout,1945
du département politique fédéral m petitpierre devant le congrès du parti radical démocratique suisse on souligne particulièrement les déclarations précisant que,1945
parti du travail obtiendrait sièges le parti socialiste suisse le parti radical démocratique le parti indépendantchrétien social le parti nal démocratique,1945
parti radical démocratique le parti indépendantchrétien social le parti nal démocratique libéral l aliance des indépendants n aurait pas obtenu le,1945
radical a transmis le communiqué suivant le comité directeur dû parti radical démocratique lausannois réuni le ï novembre a décidé de,1945
aussi pour lies cardinaux la liste de l entente lausannoise parti radical démocratique parti libéral démocratique mouvement démocrate populaire a baumgartmer,1945
lundi à heures au cercle démocratique le bureau élargi du parti radical démocratique lausannois a fait la communication suivante qui a,1945
s l et au parti libéral le bureau élargi du parti radical démocratique s est réuni le décembre pour entendre le,1945
l aux partis de la minorité que itoute décision du parti radical en ces circonstances seraient inopportunes et ne pourraient qu,1945
de la minorité à l exécutif lausannois le bureau du parti radical démocratique décide que le comité directeur et les millitants,1945
qui ont obtenu la majorité aux dernières élections que le parti radical démocratique ne participera par délégation à aucune entrevue où,1945
par des délégations ayant pouvoir de discuter utilement que le parti radical démocratique examinera la ou les propositions qui lui se,1945
de lausanne la position des radicaux le comité directeur du parti radical démocratique lausannois et le groupe radical du nouveau conseil,1945
gare de lausanne les membres du mité central élargi du parti radical démocratique vaudois se sont occupés de l élection du,1946
confederation congrès du parti radical démocratique suisse berne janvier ag dimanche a eu lieu,1946
dimanche a eu lieu à berne le congrès extraordinaire du parti radical démocratique suisse que préside m wey conseiller national de,1946
grand conseil vaudois et le conseil national où représentait le parti radical démocratique de i à i il a été ministre,1946
artisans et bourgeois ro jusqu ici f sièges socialistes ii parti radical démocratique r jeunes paysans catholiques conservateurs alliance des indépendants,1946
levée contre la candidature de m giovanoli la direction du parti radical démocratique du canton de berne vient de fixer son,1946
de la r p le bureau du comité central du parti radical démocratique vaudois s est réuni jeudi à lausanne sous,1946
a pris la parole à l assemblée des délégués du parti radical démocratique suisse à berne et a exposé les problèmes,1946
siècle surtout sur le terrain des revendications sociales en le parti radical démocratique fut présenté sur les fonts baptismaux puis ce,1946
de ans le défunt qui fut une personnalité éminente du parti radical avait fait ses études notamment à l union commerciale,1946
de l union syndicale soleuroise en et vice président du parti radical démocratique solemrois en il faisait partie du conseil national,1946
la prochaine conférence à davos l assemblée des délégués du parti radical as les délégués du parti radical démocratique de suisse,1947
sortir d g urne une rité bourgeoise voici le résultat parti radical démocratique sièges parti socialiste parti démocrate parti paysan parti,1947
la votation d obwald sarnen mal ag au nom du parti démocratique progressiste d obwald m otto durrêr kagiswil secrétaire du,1947
position berne juin ag une assemblée extraordinaire des délégués du parti radical démocratique suisse réunie à berne a fixé ton attitude,1947
élections fédérales les candidats radicaux le comité élargi du parti radical démocratique vaudois réuni samedi sous la présidence de m,1947
les élections fédérales au parti radical le congre du parti radical démocratique vaudois s est,1947
soit la liste du parti ouvrier et populaire liste du parti radical démocratique celle du parti libéral démocratique audois celle du,1947
conseil des etats ont été sées quatre listes celle du parti démocratique et celle dp parti libéral démocratique portant les deux,1947
octobre les radicaux friboubgeois se raccommodent les comités directeurs au parti libéral radical et du parti libéral radical indépendant ont décidé,1947
portant le nom de liste radicale démocratique leurs candidats le parti libéral radical fribourgeois a désigné les trois candidats suivants destinés,1947
candidats suivants destinés à figurer sur la liste commune du parti radical démocratique mm louis dupraz avocat fribourg paul piccand agriculteur,1947
géomètre à chàlel st denis l assemblée des délégués du parti radical indépendant fribourgeois a désigné les quatre candidats destinés à,1947
les forces construclivcs exerçant leur action dans le jura le parti radical bernois se fait conciliant le comité directeur du parti,1947
parti radical bernois se fait conciliant le comité directeur du parti radical démocratique du canton de berne réuni sous la présidence,1947
mission d étudier toutes les questions en suspens i e parti radical démocratique du canton de berne précise un communiqué ot,1947
d un canton à l autre congrès du parti radical démocratique suisse le congrès du parti radical démocratique suisse,1947
salut des radicaux tessinois et m bretscher rédacteur congrès du parti démocratique suisse l as emblée des délégués du parti démo,1947
citoyens ont pris part lundi soir à l assemblée du parti radical démocratique de la ville de berne que présidait m,1947
ils ne sauraient modifier la î ituatio n générale le parti radical gagne un fauteuil sur le parti soca liste et,1947
sortant premiers viennent ensuite mm kiirz hermann vuilleumier rené liste parti radical démocratique régions emmenthal mittolland haute argoyie et seeland mm,1947
premiers viennent ensu te mm bauder robert egger walter liste parti radical démocialique oberland m kunz paul sortant premiers viennent ensuite,1947
ensuite mm stucki arnold graf fritz liste parti libéral jurassien radical démocratique m moine virgile porrentruy sortant voix premiers viennent ensuite,1947
indépendants tiens sociaux perte parti républicain des etats unis le parti radical a obtenu suffrages de listes sont élus mm adrien,1947
lachenal françois perréard et andré guinand suffrages tous trois sortants parti national démocratique sùffrages de listes sont élus mm albert picot,1947
les huit conseillers nationaux élus ont obtenu les voix suivantes parti radical mm dietschi rédacteur voix schaller au troisième rang vient,1947
m rodolphe rubattel porté candidat le secrétariat du parti radical communique lors de sa dernière séance le bureau du,1947
radical communique lors de sa dernière séance le bureau du parti radical démocratique vaudois a décidé de revendiquer le siège laissé,1947
ouvrier et populaire section du parti suisse du travail pop parti radical démocratique rad parti libéral démocratique lib parti socialiste soc,1948
les partis et la votation sur le régime du sucre parti radical démocratique suisse le comité central du parti radical démocratique,1948
parti radical démocratique suisse le comité central du parti radical démocratique suisse s est occupé du régime du sucre qui sera,1948
conseiller d etat vient d informer le comité directeur du parti radical démocratique du canton de berne de sa décision de,1948
le parti socialiste suisse réaffirme sa foi dans le socialisme démocratique le parti affirme clairement l indépendance de la suisse et,1948
socialiste de l est de l europe l assemblée du parti radical l assemblée annuelle ordinaire des délégués du parti radical,1948
parti radical l assemblée annuelle ordinaire des délégués du parti radical démocratique suisse a eu lieu à baden sous la présidence,1948
les élections des organes directeurs ont eu lieu ensuite le parti radical tessinois a été désigné à l unanimité comme section,1948
a décidé de proposer aux délégués du parti libéral jurassien parti radical démocratique la candidature du conseiller national m moine de,1948
italien lncifero a parlé en outre m pini président du parti radical suisse ser l aide économique est impossible du reste,1948
internationale du libéralisme m a pini conseiller national président du parti radical démocratique de suisse a rappelé la mémoire des pionniers,1948
réforme des finances les radicaux divisés la commission spéciale du parti radical démocratique suisse a siégé à zurich pour prendre position,1948
de docteur en droit congrès radical le congrès cantonal du parti radical démocratique vaudois s est réuni dimanche après midi dans,1948
lausanne congrès radical vaudois le congrès cantonal du parti radical démocratique vaudois a tenu ses assises à lausanne il,1948
concert des nations a l occasion de la journée dn parti radical à lncerne le chef dn département politique fédéral a,1948
discours qu il a prononcé à la journée populaire du parti radical démocratique suisse à lucerne m max petitpierrè conseiller fédéral,1948
m oscar sçbnyder conservateur et m karl dellberg socialiste le parti radical démocratique valaisan a décidé de laisser à ses adhérents,1948
nous apprend que le comité permanent des affaires culturelles du parti radical démocratique s est occupé du regrettable refus de l,1948
est décédé vers heures l automobiliste a été arrêté le parti radical et la réforme des finances le comité central du,1949
radical et la réforme des finances le comité central du parti radical démocratique suisse s est réuni sous la présidence de,1949
la réforme des finances fédérales dans le délai prévu le parti radical est d avis qu il est nécessaire de préparer,1949
les candidats du parti radical lausannois l assemblée du parti radical démocratique lausannois qui,1949
cherix paul avocat chuard jules député cottier jean pierre secrétaire parti radical vaudois cottier maurice chef de bureau delay aimé conseiller,1949
faibles nuit froide plus tard température en lente hausse le parti radical le sucre suisse et m nicole le comité central,1949
le sucre suisse et m nicole le comité central du parti radical démocratique suisse s est réuni à berne sous la,1949
évoquée le avril lors de l assemblée des délégués du parti radical la jeunesse radicale suisse et la loi rircher lors,1949
de léon nicole chef communiste suisse le comité centrai du parti démocratique catholique bernois proteste de toutes ses forces contre cette,1949
proposition du comité cantonal l assem blée des délégués du parti radical démocratique du canton de saint gall a notamment voté,1949
notamment voté la résolution suivante l assemblée des délégués du parti radical démocratique du canton de saint gall s élève avec,1949
qui constitue l essence même de la démocratie suisse le parti radical démocratique condamne de la manière la plus vive cette,1949
lancé contre la loi bircher l assemblée des délégués du parti cal démocratique du canton de st gall présidée par le,1949
aboutit ag au cours d une séaricé du comité du parti radical démocratique du canton de zurich communication a été faite,1949
gollut commandant de la gendarmerie valaisanne au confédéré organe du parti radical un ancien agent de la policé de sûreté valaisanne,1949
gollut le tribunal cantonal devra donc reconsidérer cette affaire le parti radical suisse et les problèmes actuels le comité directeur du,1949
radical suisse et les problèmes actuels le comité directeur du parti radical démocratique de suisse a pris connaissance avec regret des,1949
qui s engagera incessamment s inspirent de ces considérations le parti radical démocratique suisse a constitué dès l échec des efforts,1949
d un travail approfondi et objectif le comité directeur dti parti radical démocratique a chargé dés parlementaires radicaux de les soumettre,1949
entente considérant l importance des intérêts nationaux en jeu le parti radical démocratique invite instamment les autres partis à s entendre,1949
dietschi de bêle a porté sur les propositions alternatives du parti radical qui ont déjà été publiées et commentées dans ces,1949
thurgoviens condamnent le sabotage de referendum le comité cantonal du parti radical thurgoyien s est occupé de questions actuelles de politique,1949
au peuple en revanche il salue les nouvelles propositions du parti radical démocratique de suisse en vue d une solution d,1949
et le retour a la démocratie directe le congrès du parti radical démocratique vaudois s est réuni dimanche après midi au,1949
présentes prescriptions et les dommages causés aux ouvrages fortifiés le parti radical et les tendances libérales communiqué le groupe radicaldémocratique de,1949
kobelt et petitpierre et des membres de l administration du parti radical démocratique pour examiner cr détail la situation politique actuelle,1949
pour le conseil communal de renens se feront entre le parti radical qui présente candidats le parti socialiste suisse avec candidats,1949
total lors des élections conseillers municipaux seront désignés liste no parti radical démocratique noms liste no parti libéral démocratique noms liste,1949
m graf a été pendant de nombreuses années président du parti radical démocratique du canton de saint gall,1949
on sait que la semaine dernière le comité directeur du parti radical démocratique lausannois et le groupe radical du nouveau conseil,1949
de ce préavis l assemblée gé nérale des militants du parti radical lausannois a décidé jeudi soir après une discussion approfondie,1949
travail constructif bn les candidats présentés le comité directeur du parti radical et le groupe radical du conseil communal ont tenu,1949
au département cantonal des travaux publics candidat non combattu du parti radical démocratique a été élu par voix,1949
parti bourgeois et artisan parti populaire catholique parti libéral et parti radical démocratique publient la déclaration suivante les partis soussignés considèrent,1949
de cessation de l aide fédérale à la construction le parti radical démocratique le comité central du parti radicaldémocratique suisse s,1950
loi fédérale qui sera soumis au peuple le janvier au parti démocratique suisse le comité central du parti démocratique suisse tenant,1950
la votation du janvier décisions libérale le comité directeur du parti béral démocratique vaudois réuni lundi à lausanne sous la présidence,1950
à la construction de logements et radicale le bureau du parti radical démocratique vaudois a décidé de recommander aux électeurs l,1950
subventions fédérales à la construction de logements le comité du parti radical suisse rappelons le s est prononcé contre l arrêté,1950
de balê campaône les partis des paysans artisan t bourgeois radical démocratique populaire catholique et chrétien social ainsi que la fédération,1950
populaire catholique et chrétien social ainsi que la fédération du parti démocratique ont convenu l établissement d une liste commune de,1950
parti paysans artisans et bourgeois ancien ernest bcèrlin conseiller national parti radical démocratique nouveau paul guertler procureur parti populaire catholique nouveau,1950
du parti paysans artisans et bourgeois et deux candidats du parti radical démocratique,1950
de six candidats le parti paysan artisan et bourgeois le parti radical démocratique le parti populaire catholique et le parti libéral,1950
démocratique le parti populaire catholique et le parti libéral jurassien radical démocratique soutiendront les quatre représentants actuels max gafner markus feldmann,1950
les délégués du parti radical en faveur du projet de réforme des finances fédérales,1950
réforme des finances fédérales samedi après midi les délégués du parti radical démocratique suisse se sont réunis à qlten pour prendre,1950
petitpierre a exposé dimanche à l assemblée des délégués du parti radical démocratique suisse à lugano les raisons pour lesquelles il,1950
le parti radical et notre défense nationale le comité central du parti,1950
parti radical et notre défense nationale le comité central du parti radical démocratique suisse a discuté sous la présidence du conseiller,1950
centenaire du bund notre confrère lé bund organe du parti radical démocratique du canton de berne fête le me anniversaire,1950
évangélique de suisse s est prononcé pour le régime le parti radical démocratique suisse après un appel de m petitpierre s,1950
nationale économique le lundi décembre à sous les auspices du parti radical démocratique lausannois centre saint roch m le dr j,1950
toute la suisse la direction du parti radical et la situation internationale le comité directeur du parti,1951
parti radical et la situation internationale le comité directeur du parti radical démocratique suisse présidé par m afcardo pini présidant du,1951
de vote pour le suffrage féminin le congrès cantonal du parti radical démocratique vaudois réuni dimanche après midi sous la présidence,1951
qu il a prononcé dimanche à coire au congrès du parti radical suisse m max petitpierre conseiller fédéral a traité deux,1951
fédéral a pris la parole dimanche devant les délégués du parti radical démocratique suisse réunis en congrès à coire après avoir,1951
de santé une seule liste a été déposée celle du parti radical démocratique portant le nom de m jean louis fornerod,1951
baertschi président de la ville de berne a informé le parti radical démocratique qu il quitterait ses fonctions de conseiller communal,1951
de la ville à la fin de cette année le parti radical démocratique revendiquera le siège laissé vacant à l exécutif,1951
à l occasion d une assemblée de délégués extraordinaire du parti radical démocratique suisse qui s est tenu à zoug le,1951
au conseil national c p le parti conservateur et le parti radical du canton de fribourg ont décidé chacun de présenter,1951
national m jules luisier député dirigera l assem blée du parti radical démocratique recrudescence des accidents c p il y a,1951
dépôt des listes les candidats radicaux vaudois le congrès du parti radical démocratique vaudois a réuni plus de délégués représentant toutes,1951
bernois et radicaux jurassiens une gaffe évitée de justesse le parti radical démocratique du canton de berne communique le comité central,1951
parti catholique conservateur voix sièges parti libéral jurassien voix siège parti radical démocratique mittelland emmental haute argovie seeland voix sièges parti,1951
parti radical démocratique mittelland emmental haute argovie seeland voix sièges parti radical démocratique oberland voix siège parti libéral socialiste économie franche,1951
léon nicole sortant cumulé voix jean vincent sortant cumulé voix parti national démocratique m aymon de senarclens sortant voix parti indépendant,1951
sortant voix parti socialiste m jean treina nouveau cumulé voix parti radical mm andré guinand sortant voix françois perréard sortant et,1951
liste catholique m jules blunschi nouveau avec voix argovie le parti radical démocratique et mouvement des jeunes radicaux obtient sièges sans,1951
évangélique populaire parti démocrate parti du travail parti paysan parti radical de la ville de zurich parti radical de la campagne,1951
mandats est passé de à le parti paysan et le parti radical gagnent chacun un siège le parti libéral socialiste perd,1951
évangélique parti démocrate parti du travail paysans artisans et bourgeois parti radical de la ville de zurich parti radical de la,1951
premier des viennent ensuite andré calame bienne ancien non réélu parti radical démocratique emmental mittelland berne district de l aar seeland,1951
muller amriswil a communiqué ce qui suit au président du parti radical démocratique du canton de thurgovie il est douteux que,1951
et l affaire muller amriswil une assemblée fort nombreuse du parti radical démocratique de romanshqrn après une ample discussion a décidé,1951
de se désolidariser de la récente décision du comité du parti radical démocratique on sait en effet que ce dernier a,1951
toute la sussse parti radical démocratique et le financement des armements le comité directeur,1952
démocratique et le financement des armements le comité directeur du parti cal démocratique suisse s est prononcé à l unanimité pour,1952
père william barbey a été député l autre par le parti radical démocratique avec le nom de m louis petermann agriculteur,1952
et conseiller national me j p cottier secrétaire général du parti radical démocratique vaudois gabriel despland conseiller d etat et conseiller,1952
de montbenon pour assister à la manifestation organisée par le parti radical démocratique lausannois et la municipalité de lausanne en l,1952
de son chef m henri bujard m favre président du parti radical lausannois salua les personnalités présentes le conseil d etat,1952
m max petitpierre a prononcé un discours au congrès du parti radical j hésite à parler de la situation internationale a,1952
usage les congrès politiques l assemblée des délégués d u parti radical démocratique après avoir entend u u n discours de,1952
fut pendant de jongues années une des personnalités dirigeantes du parti radical démocratique,1952
conseil dé schaffhouse parti paysan jusqu ici parti ouvrier socialiste parti radical démocratique parti populaire catholique alliance des indépendant parti populaire,1952
populaire catholique alliance des indépendant parti populaire évengélique mouvement jeune radical sans parti le parti libéral socialiste autrement dit le mouvement,1952
radicaux et l a v s le comité iv du parti radical démocratique suisse réuni à zurich a souscrit en principe,1953
pour le bas valais le cinquième siège étant dévolu au parti radical dont les délégués ont siégé à fully tandis que,1953
n a pas fallu de longs palabres au sein du parti radical démocratique pour prendre position au sujet de la participation,1953
avec gandhi fut expulsé du parti fonda le sien le parti radical démocratique et se décida bientôt à le dissoudre convaincu,1953
qu il présida en de à il fut président du parti radical démocratique suisse les obsèques de m max wey auront,1953
confédération le parti radical suisse prend position a l égard des finances fédérales,1953
a l égard des finances fédérales le comité central du parti radical démocratique suisse s est réuni à genève sous la,1953
par les chambres le projet ne donne pas satisfaction au parti radical cependant le rapporteur m bauder de bienne a déclaré,1953
même jour et dans la même ville les délégués du parti radical démocratique suisse ont également décidé d approuver le nouveau,1953
vaudois contre le projet de réforme desfinancesfédérales le congrès du parti radical démocratique vaudois s est réuni dimanche après midi au,1953
contre non la résolution suivante l assemblée des délégués du parti radical démocratique vaudois réunie dimanche à morges considérant que le,1953
