Sentence,Year
de recommander le rejet de ce projet citons notamment le parti radical du canton de zoug celui de bâle campagne celui,1953
de bâle campagne le parti chrétien social de lucerne le parti démocratique de zurich et gré bien des hésitations l alliance,1953
conseil d etat de zurich l assemblée des délégués du parti radical démocratique du canton de zurich a décidé à l,1954
candidat au conseil d etat l assemblée des délégués du parti radical du canton de zurich est convaincue de présenter en,1954
au conseil d etat zougois l assemblée des délégués dlu parti radical démocratique du canton de zoug a décidé de porter,1954
de jeunes gens jura bernois e section du seeland du parti radical démocratique a décidé mercredi soir à l unanimité au,1954
pour remplacer m seematter a l assemblée des délégués du parti radical démocratique du canton de berne la répartition des voix,1954
parti des paysans artisans et bourgeois a obtenu mandats le parti socialiste démocratique le parti radical démocratique le parti conservateur catholique,1954
confederation le le parti radical suisse et l initiative chevallier vaitemblée ordinaire des déligués,1954
suisse et l initiative chevallier vaitemblée ordinaire des déligués du parti radical démocratique suisse qui se tient pour la dernière fois,1954
ses répercussions sur notre pays l orateur déclara que le parti radical se devait de prendre position contre l initiative tendant,1954
été élu par voix m e fritschi présenté par le parti radical et soutenu par le parti paysan a recueilli voix,1954
l opinon des radicaux de bale ville le congrès du parti radical démocratique de bâle ville a décidé d inviter les,1954
salaires et traitements et de bale campagne les délégués du parti radical de bâle campagne ont décidé à mité moins une,1954
conservateur populaire suisse parti démocrate suisse parti populaire évangélique suisse parti radical démocratique suisse parti suisse des paysans artisans et bourgeois,1954
les radicaux saint gallois et le régime des finances le parti radical démocratique du canton de saint gall a tenu son,1954
revendiquent un siège au conseil fédéral le comité directeur du parti radical tessinois réuni sous la présidence de m olgiati président,1954
à m e dietschi conseiller nationa à baie président du parti radical démocratique suisse et à m a guinand conseiller national,1954
m a guinand conseiller national de genève président du groupe radical démocratique de l assemblée fédérale,1954
les vacances au conseil fédéral le comité central élargi du parti radical démocratique audois à lausanne réuni le octobre après avoir,1954
prise de position avant les élections du décembre le groupe radical démocratique admettrait l admission d un socialiste au conseil fédéral,1954
socialiste au conseil fédéral lors d une réunion du groupe radical démocratique des chambres présidée par m andré guinand genève une,1954
exposés du président de l assemblée et du président du parti radical démocratique de suisse le conseiller national dietschi de bâle,1954
sera bientôt le brillant syndic de bonne heure attaché au parti radical il le sert fidèlement lui consacre bien du temps,1954
chaudet s est cependant imposée et hier le représentant du parti radical démocratique et en même temps de la suisse romande,1954
grand conseil de genève dit quelques mots au nom du parti radical suisse il apporte lès félicitations de ce parti auxquelles,1954
radicaux et l ïnîtiattve syndicale l assemblée dtes délégués du parti radical démocratique suisse réunie à oltén s est prononcée à,1955
pour une baisse des impôts fédéraux le parti radical démocratique du canton de lucerne d entente avec d,1955
auenir m dietschi conseiller national de bâ e président du parti radical démocratique suisse a transmis le salut des radicaux suisses,1955
présence mm françois perréard et victor gautier portés par le parti radical et le parti national démocrate antoine pugin porté par,1955
m gotthard egli qui ne sollicite pas sa réélection thurgovie parti radical le parti radical démocratique du canton de thurgovie a,1955
sa place dans la société et dans le pays le parti radical démocratique suisse a tenu hier un grand congrès au,1955
été finalement votée par l assemblée elle déclare que le parti radical recherchera en matière de politique économique et sociale des,1955
une mise au point du parti radical vaudois le comité cantonal du parti radical démocratique vaudois,1955
vaudois ont excédé les limites de la propagande électorale le parti radical déplore que dans un canton aussi attaché aux traditions,1955
confédération vn communiqué de la direction du parti radical suisse m chaudei ei l armée de milice la,1955
m chaudei ei l armée de milice la direction du parti radical démocratique de suisse communique le fait que m chaudet,1955
autre part certaines déclarations ont été dénaturées la direction du parti radical démocratique de suisse constate que m chaudet conseiller fédéral,1955
parlementaires des affaires militaires et ensuite lors du congrès du parti radical à lausanne il a souligné expressément qu il s,1955
coûterait milliards de francs est contraire à la vérité le parti radical démocratique de suisse regrette que le débat sur les,1955
deviendra le plus fort groupe du parlement et que le parti radical perdra la première place en vérité ces changements seront,1955
d abord des circonstances prnnres au canton de vaud le parti radical y traverse une crise d une vité exceptionnelle longtemps,1955
capitale a quoi s ajoute que de notoriété publique le parti radical est gravement divisé à tel point que l on,1955
bruderer radical et flisch socialiste n étaient plus candidats le parti radical démocratique a obtenu suffrages de parti et le parti,1955
m clemens meienberg conseiller d etat a obtenu voix le parti radical a obtenu suffrages de listes le parti conservateur chrétien,1955
par voix armin bruhin notaire lachen nouveau présenté par le parti radical et le mouvement ieune radical voix et hans fuchs,1955
catholique et chrétien social m rainer weibel nouveau liste du parti radical démocratique de l emmental mittelland haute argovie vallée de,1955
ancien ernst studer ancien valoton von greyerz nouveau liste du parti radical démocratique de ces et acquis une autorité et une,1955
stuenzi ancien hans duby nouveau fritz giovanoli nouveau liste du parti démocratique catholique m etienne philippe ancien liste de l alliance,1955
ancien fritz herren ancien et constant overnay nouveau par voix parti radical démocratique m pierre glasson conseiller d etat ancien parti,1955
progression doit encore être élargie election complémentaire a schaffhouse le parti radical démocratique du canton de schaffhouse a arrêté son attitude,1955
reste à sièges le groupe jeune berne en obtient le parti radical démocratique passe de à fauteuils le parti bourgeois en,1955
ont commencé à fribourg lés travaux du congrès ordinaire du parti radical démocratique suisse qui siégera dané cette ville jusqu à,1956
des femmes catholiques nouvelle société helvétique parti conservateur populaire suisse parti démocratique suisse parti libéral socialiste suisse parti populaire évangélique suisse,1956
démocratique suisse parti libéral socialiste suisse parti populaire évangélique suisse parti radical démocratique suisse parti suisse des paysans artisans et bourgeois,1956
réaliser une démocratie de justice et de liberté solidarité du parti radical la direction et le comité central du parti radical,1956
parti radical la direction et le comité central du parti radical démocratique suisse ont siégé samedi à berne sous la présidence,1956
libérales se sont réunis récemment à brigue pour fonder le parti radical démocratique de cette ville m jacob kaenzig de brigue,1956
m maillard chef de gare à st légier yverdon le parti radical démocratique a établi une liste de sept candidats mm,1957
un candidat m emile roy agriculteur à st livres le parti radical porte à nouveau m frédéric betterns ingénieur à aubonne,1957
le château et albert thurin agriculteur viticulteur à st saau parti radical déclinent une nouvelle candidature le parti radical présente pour,1957
a déjà déposée le parti socialiste et celle que le parti radical démocratique a constituée dans son assemblée générale du er,1957
tous les soirs à demain et m benjamin romieux le parti radical démocratique lausannois quartier centre saint roch organise le lundi,1957
constitutionnel sur la radio et la télévévision les délégués du parti radical démocratique suisse le congrès du parti radical démocratique suisse,1957
de l armée et de l instruction des soldats le parti démocratique suisse le comité central du parti démocratique suisse a,1957
accroître le volume confédération devra trouver des constructions routières le parti radical suisse en congrès à winterthour le chef des finances,1957
fédérales plaide pour le compromis des impots le congrès du parti radical démocratique de suisse s est tenu ce week end,1957
eugène dietschi président central qui avait ouvert le congrès du parti radical dans son rapport d activité il a notamment déclaré,1957
a lausanne le congrès radical le parti radical démocratique vaudois a tenu son congrès hier,1957
fribourg numéro de fête pi l indépendant organe du parti radical démocratique de fribourg a blié hier un numéro de,1957
plus appel à la personne qu au parti le parti radical démocratique ne se trouvera pas scindé en radicaux et jeunes,1957
principe de la rp la r p lancée par le parti radical a eu pour première conséquence la constitution d une,1957
parti qui recommande un double oui au prochain scrutin le parti radical démocratique de suisse a tenu samedi après midi berne,1957
sur quoi un deuxième recours signé par deux membres du parti radical a été déposé à la préfecture celui ci porte,1957
radicaux vaudois deux fois oui le novembre le congrès du parti radical démocratique vaudois réuni samedi à lausanne sous la présidence,1957
le comité directeur du parti socialiste bernois le comité du parti radical démocratique schaffhousois le comité national du mouvement suisse des,1958
lausanne et charles sollberger conseiller d etat bex celle du parti libéral démocratique portant les noms de mm louis guisan conseiller,1958
d etat yverdon et georges thévoz agriculteur missy celle du parti radical démocratique portant les noms de mm gabriel despland conseiller,1958
et ressources suffisantes pour l etat central le congrès du parti radical démocratique suisse qui groupait samedi délégués à olten a,1958
s est déroulée au sein d une commission spéciale du parti radical démocratique suisse elle a décidé de visiter quelques entreprises,1958
lors d une séance tenue samedi le comité cantonal du parti radical démocratique fribourgeois a entendu un exposé de m pierre,1958
le parti radical démocratique vaudois a le très grand regret faire part,1958
des vignerons de les radicaux et les finances fédérales le parti radical démocratique vaudois a tenu samedi après midi au cercle,1958
de la confédération soumis aux électeurs le mai prochain le parti radical vaudois confirme son opposition de principe à l impôt,1958
pour les cantons des conséquences politiques et financières graves le parti radical recommande à tous lés citoyens d accepter l arrêté,1958
un technicum une initiative populaire a été lancée par le parti radical démocratique de bâle ville pour inviter le grand conseil,1958
armement atomique le parti radical suisse accorde sa confiance au gouvernement le comité directeur,1958
suisse accorde sa confiance au gouvernement le comité directeur du parti radical démocratique de suisse a fixé son attitude à l,1958
une catastrophe pour le monde libre le comité directeur du parti radical de suisse comme le groupe radical démocratique de l,1958
assainissement des finances vaudoises mesures proposées au congrès du parti radical vaudois le congrès cantonal ordinaire du parti radical démocratique,1958
parti radical vaudois le congrès cantonal ordinaire du parti radical démocratique vaudois s est tenu hier après midi à lausanne sons,1958
les modalités et d exiger simultanément de nouvelles économies le parti radical a défini ainsi une politique commune qui permettra à,1958
assemblée des délégués du parti radical démocratique samedi s est ouverte à olten l assemblée,1958
par l office en question gdl berne suffrage féminin le parti radical démocratique du canton de berne lors de son assemblée,1959
l introduction du suffrage féminin des partis prennent position le parti radical démocratique suisse laisse la liberté de vote une assemblée,1959
la liberté de vote une assemblée extraordinaire des délégués du parti radical démocratique suisse a eu lieu samedi après midi à,1959
antidémocratique dans les libertés du peuple le comité central du parti démocratique suisse s est réuni à zurich sous la présidence,1959
assemblée cette proposition fut acceptée par voix contre ainsi le parti radical laissera la liberté de vote à ses membres pour,1959
voter en faveur du projet instituant le suffrage féminin le parti radical démocratique thurgovien recommande le rejet,1959
congrès extraordinaire du parti radical zuricois le congrès extraordinaire du parti radical démocratique du,1959
concernant la protection civile la commission de politique sociale du parti radical démocratique suisse a siégé à berne pour étudier des,1959
campagne avant les élections l as semblée des délégués du parti radical démocratique de bâle campagne a dé j cidé dans,1959
suisses et la protection civile l assemblée des délégués du parti radical démocratique de suisse a eu lieu samedi à berne,1959
au congrès du parti radical suisse m max petitpierre a consacré un discours aux,1959
actuellement posés à notre pays l assemblée des délégués du parti radical démocratique suisse s est réunie samedi et dimanche à,1959
longuement le discours du conseiller fédérul petitpierre le congrès du parti radical démocratique suisse a approuvé un appel au peuple suisse,1959
d oex le congrès des radicaux vaudois le congrès du parti radical démocratique vaudois s est réuni dimanche après midi à,1959
au conseil des etats zurich l assemblée des délégués du parti radical démocratique du canton de zurich réunie samedi à zurich,1959
etats ernest vaterlaus pour les élections au conseil national le parti radical présentera de nouveau une liste de la ville et,1959
doit être une constunte de notre etot aux assises du parti radical démocratique dans le discours qu il a prononcé à,1959
qu il a prononcé à l occasion du eongrès du parti radical démocratique suisse à lucerne m streuli conseiller fédéral a,1959
canton qui appellent de leurs la formation d une entente parti radical démocratique vaudois parti libéral démocratique vaudois parti dès paysans,1959
fixés et qui répondent à la volonté du peuple vaudois parti radical démocratique vaudois parti libéral démocratique vaudois parti des paysans,1959
manière indépendante aux élections de parti bourgeois parti socialiste parti radical démocratique alliance des indépendants bulletins sans désignation de parti la,1959
avait été élu au conseil d etat comme représentant du parti radical démocratique m werner vogt conseiller d etat depuis a,1959
pierre glasson démissionnaire de m emile zehnder candidat officiel du parti radical fribourgeois bourgeois de morat le nouveau conseiller d etat,1959
et de l instruction publique a informé la direction du parti radical démocratique du canton à l intention du corps électoral,1959
conseiller fédéral tschudi le siège so cialiste passe a u parti radical a u premier tour de scrutin m dietschi avait,1960
il présida en m dietschi est actuellement président d u parti radical démocratique suisse il est colonel d aviation,1960
par année a l occasion d une manifestation publique du parti radical démocratique de la ville et du district de saint,1960
est prévue dans le projet neuchâtelois le comité directeur du parti radical démocratique a décidé de laisser la liberté de vote,1960
grand conseil de saint gall parti populaire conservateur chrétiensocial gain parti radical démocratique et mouvement jeune radical perte parti social démocrate,1960
rhee contrôle des loyers prises de position pag e le parti radical démocratique suisse a tenu samedi son assemblée générale ordinaire,1960
contrôle des loyers prises de position le parti radical démocratique suisse soutient le projet du conseil fédéral le,1960
radical démocratique suisse soutient le projet du conseil fédéral le parti radical démocratique suisse a tenu samedi à bienne son assemblée,1960
lors du déjeuner qui a réuni samedi les délégués du parti radical démocratique le conseiller fédéral chaudet prit la parole il,1960
gazette des cantons fribourg les radicaux prolesient le parti radical démocratique fribourgeois a tenu son assemblée ordinaire des délégués,1960
jeunes schaffhouse candidat au conseil d etat le comité du parti radical démocratique eu canton de schaffhouse vient de siéger pour,1960
par voix de même que le candidat présenté par le parti radical démocratique pour la présidence de la commission scolaire par,1960
dans le monde actuel a olten devant l assemblée du parti radical suisse m max petitpierre brosse un tour d horizon,1960
et en font u n être responsable la résolution du parti radical suisse a l issue de la séance l assemblée,1960
l issue de la séance l assemblée des délégués du parti radical démocratique suisse a approuvé à l unanimité une résolution,1960
protection civile font partie intégrante de la défense nationale le parti radical se prononce pour une économie libérale et pour une,1960
finances vient de faire parvenir une lettre au comité du parti radical démocratique de son canton auquel il appartient lettre dans,1961
a grand pont bis au japon pays des contrastes le parti radical démocratique lausannois association centre saint roch organise lundi février,1961
s a gdpont bis au japon pays des contrastes le parti radical démocratique lausannois association centre saint roch organise lundi février,1961
moderr es entrée fr au japon pays des contrastes le parti radical démocratique lausannois association centre saint hoch organise lundi février,1961
forum sur l enfance inadaptee et la delinquance juvenile le parti radical démocratique lausannois organisera le vendredi mars à h au,1961
le parti radical suisse prépare la succession de m peiiipierre la direction,1961
suisse prépare la succession de m peiiipierre la direction du parti radical démocratique suisse et le comité du groupe dical démocratique,1961
assemblée fédérale à la session de juin la direction du parti radical démocratique suisse et le comité eu groupe des chambres,1961
conseiller fédéral petitpierre doit revenir san doute éucun au groupe radical démocratique la direction et le comité du groupe rapporteront au,1961
grand conseil les voix se répartissent de la façon suivante parti radical démocratique voix parti populaire conservateur chrétiensocial parti socialiste voix,1961
au parti radical vaudois m pierre schumacher successeur désigné de m gabriel,1961
m pierre schumacher successeur désigné de m gabriel despland le parti radical démocratique vaudois a tenu samedi un congrès extraordinaire à,1961
au congrès que le siège vacant au juin revient au parti radical et qu il n est contesté jusqu ici par,1961
la réponse des radicaux lausannois à la petite entente le parti radical démocratique lausannois nous a fait tenir l information suivante,1961
en vue des élections communales lausannoises en novembre prochain le parti radical au terme de discussions courtoises n a pu se,1961
il n y a pas d alliance radicale socialiste le parti radical ira seul à la lutte sans alliance à gauche,1961
elections communales les radicaux lausannois ont choisi leurs candidats le parti radical démocratique lausannois a tenu mercredi au cercle démocratique une,1961
service de la santé publique armand benoit avocat secrétaire du parti radical lausannois et maurice rochat avocat secrétaire du parti radical,1961
parti radical lausannois et maurice rochat avocat secrétaire du parti radical vaudois voici enfin les noms des onze candidates m isabelle,1961
du labour n est il pas alors de devenir un parti radical démocratique de faire à sa façon la conversion qu,1961
fr l assemblée des délégués du parti radical démocratique du canton de soleure réunie sous la présidence,1961
listes portant les noms des sept candidats la liste du parti libéral démocratique portant le nom de m l gutsan conseiller,1962
m l gutsan conseiller d etat sortant la liste du parti radical démocratique portant les noms de mm p oguey p,1962
contre l armement atomique l assemblée extraordinaire des délégués du parti radical démocratique suisse a décidé samedi après midi à berne,1962
obtient deux sièges le parti conservateur chrétien social et le parti radical démocratique devront de ce fait céder chacun un siège,1962
et bourgeois présente candidats dont sortants le parti socialiste le parti radical démocratique le parti conservateur chrétien social l alliance des,1962
analysent la situation politique et économique suisse lucerne congrès du parti radical démocratique helvétique le président de la confédération conjuguons nos,1962
terminer le président de la confédération ats lucerne mai le parti radical démocratique de suisse s est réuni en congrès à,1962
la parole dimanche à l assemblée ordinaire des délégués du parti radical démocratique suisse m chaudet a examiné la question de,1963
le signe du dynamisme de notre économie libérale assemblée du parti radical démocratique suisse déclare le conseiller fédéral h schaffner l,1963
ses lettres de créance au palais fédéral retrait schaffhotjse le parti radical démocratique du canton de schaffhouse annonce que le conseiller,1963
prélude aux élections fédérales conseil national candidats radicaux lausannois le parti radical démocratique réuni mercredi soir à lausanne a désigné trois,1963
la situation politique à genève se précise les délégués du parti radical ont en effet désigné leur candidat au conseil des,1963
pfammatter de loèche ville jura l assemblée des délégués du parti démocratique chrétien social jurassien réuni à glovelier a décidé de,1963
l ancien canton et du district de laufon fribourg le parti radical démocratique fribourgeois réuni dimanche après midi à fribourg a,1963
de bain candidat i zurich l assemblée des délégués du parti radical démocratique du canton de zurich a désigné le professeur,1963
à ces forums sur les élections aux chambres fédérales sont parti radical démocratique m ges andré chevallaz radio m alfred borel,1963
aux journalistes qui prendront part à ces débats ce sont parti radical démocratique m andré rougemont radio tv parti conservateur chrétien,1963
de suisse approuve la conception du conseil fédéral et du parti radical démocratique suisse et repousse toute augmentation des cotisations il,1963
social du parti suisse des paysans artisans et bourgeois du parti radical démocratique du parti démocratique et du parti populaire évangélique,1964
de l économique et du social assemblée des délégués du parti radical suisse a locarno déclare m paul chaudet conseiller fédéral,1964
suisse a locarno déclare m paul chaudet conseiller fédéral le parti radical démocratique suisse a ten u samedi et dimanche son,1964
gazette des cantons vaud m chevallaz president du parti radical le congrès du parti radical démocratique vaudois a eu,1964
par m gajner et un exposé de m debétaz le parti radical vaudois a décidé de recommander aux électeurs de noter,1964
à l occasion de l assemblée ordinaire des délégués du parti radical démocratique suisse m chaudet chef du département militaire a,1965
boulimie divers cercle democratique place de la rlponne conférence du parti radical démocratique la fusion des eglises,1965
d assurer à notre défense nationale sa pleine efficacité le parti radical démocratique vaudois rappelle surtout que la définition d e,1965
études organisées à gyrenbad au dessus de turbenthal par le parti radical démocratique du canton de zurich et consacrées au problème,1965
kalt feront également partie du comité elections candidats montreux le parti radical démocratique de montreux a désigné ses candidats et candidates,1965
