Sentence,Year
reuter bome dissensions rome la réunion de la direction du parti démocrate chrétien consacrée à la crise ministérielle a été suspendue,1966
document politique vé à l unanimité par sa direction le parti démocrate chrétien italien exprime sa volonté de relancer la politique,1966
radical reste dans l expectative et attend vraisemblablement que le parti conservateur chrétien social désigne son candidat pour se prononcer à,1966
prononcer à son tour officiellement l assemblée des délégués du parti conservateur se tiendra samedi février et leur choix sauf coup,1966
d e fribourg samedi les délégués d u part i conservateur chrétien social fribourgeois réunis en assemblée extraordinaire à fribourg ont,1966
vraisemblablement à un e élection disputée samedi les délégués du parti conservateur chrétien social fribourgeois se sont réunis en assemblée extraordinaire,1966
morard a obtenu suffrages et son rival le candidat du parti conservateur appartient à une lignée d hommes politiques son grand,1966
r çu jeudi soir séparément deux personnalités en vue du parti démocrate chrétien mm mario scelba et amintorè fanfani afin de,1966
compte sur l appui d un de ses collègues du parti démocrate chrétien l une des premières personnalités que m moro,1966
fait que a participation au futur gouvernement acceptée par le parti démocrate chrétien est vigoureusement combattu e par les socialistes lui,1966
qui finit bien a claré m mariano rumor secrétaire du parti démocrate chrétien nous avons conclu un bon accord a firmé,1966
a souligné pour sa part m mario tanassi secrétaire du parti démocrate socialiste tout le monde est satisfait du programme gouvernemental,1966
affaires étrangères m amintore fantani son rival au sein du parti démocrate chrétien pour accommoder m mario scelba chef de l,1966
dont le principal est celui de la défense attribué au social démocrate roberto tremelloni ap la composition ou cabinet es compose,1966
le nouveau cabinet de la façon suivante président du conseil chrétien démocrate vice président du conseil nenni socialiste ministres sans portefeuille,1966
nouveau ministre giovanni battista scag ia c d virgilio bertinelli social démocrate nouveau affaires étrangères amintore fanfani intérieur paolo emilio taviani,1966
ale républicain budget gto rafini pieraccini socialiste finances luigi preti social démocrate transféré trésor emilio colombo c d défense roberto tremelloni,1966
en ce qui concerne les élections communales en effet le parti conservateur chrétien social vient de perdre la rité après sauf,1966
ajouter l étude de m j p chassériaud sur le parti démocrate chrétien italien étude rédigée en et ne paraissant qu,1966
et sociales série etudes européennes iii jean paul chassériaud le parti démocrate chrétien en italie paris armand colin cahiers de la,1966
cette revendication que le parti agraire avait voulu donner au parti conservateur chrétien social une preuve de sa lonté de collaboration,1966
on peut toutefois supposer dans la situation actuelle que le parti conservateur soucieux de s attirer les bonnes grâces de la,1966
ironie d erhard berlin au cours d une manifestation du parti démocrate chrétien à berlin le chancelier erhard a réitéré ses,1966
au conseil national lors de précédentes législatures dans le même parti conservateur chrétien social m jean babel conseiller d etat genevois,1966
voté selon le système majoritaire ont donné la majorité au parti démocrate chrétien et ont été conquises par des listes d,1966
les propositions avancées par m rainer barzel vice président du parti démocrate chrétien en matière de réunification allemande m barzel a,1966
chrétiens sociaux fribourgeois s organisent en parti indépendant le groupe chrétien social fribourgeois affilié jusqu ici au parti conservateur chrétien social,1966
chrétien social fribourgeois affilié jusqu ici au parti conservateur chrétien social fribourgeois a décidé de se constituer en parti indépendant un,1966
les élections au conseil d etat de décembre prochain le parti conservateur et le parti tien social établiront une liste commune,1966
l indépendance du nouveau venu fribourg après la fondation du parti chrétien social le juillet le groupe politique chrétien social se,1966
le juillet le groupe politique chrétien social se constituait en parti indépendant chrétien social les délégués de tous les districts et,1966
m max aebischer conseiller national député et président du mouvement chrétien social fribourgeois qui groupe toutes les organisations tiennes sociales du,1966
partisans du nouveau parti qui entendent militer désormais indépendamment du parti conservateur chrétien social il y a ensuite les adversaires d,1966
à la fois à la cause chrétienne sociale et au parti conservateur chrétien social il y a enfin les partisans et,1966
sociaux de la singine qui tout en demeurant fidèles au parti conservateur chrétien social entendent pour les prochaines élections présenter une,1966
prochaines élections présenter une liste distincte apparentée à celle du parti conservateur chrétien social cela étant les chrétiens sociaux auront toute,1966
trois possibilités m aebischer lui même va rester fidèle au parti conservateur chrétien social tout en souhaitant du succès au nouveau,1966
faudra au préalable fournir la preuve que la création du parti indépendant chrétien social marque effectivement la volonté de ses adhérents,1966
véritable division a ce sujet le fribourgeois organe officiel du parti conservateur tien social précise qu il n y a pas,1966
parler et s il y a indépendance des deux groupes conservateur et chrétien social la marche reste parallèle et harmonisée pour,1966
marche reste parallèle et harmonisée pour autant que le groupe chrétien social ne soit pas un jour noyauté et soumis à,1966
âge et des raisons de santé ats gdl valais le parti conservateur désignera son président le comité du parti conservateur chrétien,1966
parti conservateur désignera son président le comité du parti conservateur chrétien social a décidé de proposer la candidaturc du conseiller national,1966
fribourg avant les élections la scission est imminente dans le parti conservateur de notre correspondant le premier bulletin politique du parti,1966
parti conservateur de notre correspondant le premier bulletin politique du parti indépendant chrétien social conquête chrétienne sociale vient de paraître ses,1966
pensé à un simple calcul électoral de la part du parti conservateur chrétien social en prévision des élections générales d automne,1966
faut convenir que le rédacteur du fribourgeois organe officiel du parti conservateur chrétien social justifiait cette méfiance lorsqu il écrivait il,1966
il y a bel et bien scission nous quittons le parti conservateur parce que nous sommes majeurs conservateur et chrétien social,1966
parti conservateur parce que nous sommes majeurs conservateur et chrétien social la marche reste parallèle et harmonisée pour autant que le,1966
marche reste parallèle et harmonisée pour autant que le groupe chrétien social ne soit pas un jour noyauté et soumis à,1966
qu un mariage de raison momentané si l affranchissement du parti indépendant chrétien social se vérifie dans les faits en automne,1966
parlement et inversement c est pourquoi l aile libérale du parti conservateur n est pas mécontente de la scission des chrétiens,1966
fouet salutaire il ne faut pas oublier que si le parti conservateur s est maintenu au pouvoir durant un siècle s,1966
tous les membres du conseil national debout au nom du parti démocrate chrétien et de tout le peuple italien m mario,1966
électeurs fribourgeois ont nifesté leur désaveu à l égard du parti conservateur chrétien social il relève également que ces succès remportés,1966
fribourgeois armand niquille fribourg un rapport le comité cantonal du parti conservateur chrétien social fribourgeois s est réuni à fribourg le,1966
fribourg le parti conservateur a tenu une assemblée d information les délégués cantonaux,1966
a tenu une assemblée d information les délégués cantonaux du parti conservateur chrétien social du canton de fribourg ont tenu une,1966
par le comité cantonal et l assemblée des délégués du parti conservateur chrétien social fribourgeois de rajeunir et les organes de,1966
les ambitions personnelles convaincus que l application des principes du parti conservateur chrétien social résoudra le mieux les problèmes d aujourd,1966
le parti conservateur chrétien social et la loi sur la banque d,1966
la revision d la loi sur la banque nationale le parti conservateur chrétien social suisse commence par constater qu il attache,1966
congrès du parti conservateur chrétien social des revisions partielles avant la réforme de,1966
social des revisions partielles avant la réforme de petat le parti conservateur chrétien social suisse a tenu samedi et dimanche ses,1966
von moos a rappelé l éthique chrétienne qui anime le parti conservateur chrétien social suisse,1966
ayer et alphonse roggo ont communiqué au comité directeur du parti conservateur chrétien social fribourgeois leur décision de ne pas accepter,1966
les communiqués remis à la presse ces derniers temps le parti conservateur faisait régulièrement état de sa volonté d apporter un,1966
cet état de choses mais chacun se demandait si le parti conservateur tirerait pratiquement la leçon de cette élection il l,1966
de savoir qui seront les futurs candidats ad préalable le parti conservateur de vra choisir enfre les deux tendances qui se,1966
dure s pensent que l heure a sonné pour le parti conservateur d aller seul au combat même s il risque,1966
avec plus de réticence à accepter un éventuel candidat indépendant chrétien social beaucoup de candidats si la thèse des durs triomphait,1966
chrétiennes sociales oh placerait m max aebischér président du mouvement chrétien social fribourgeois qui a dès le moment de la scission,1966
dès le moment de la scission affirmé sa fidélité au parti conservateur dans la constellation actuelle on peut être à peu,1966
qui ne porte pas encore de nom voilà pour le parti conservateur de son côté le candidat socialiste m jean riesen,1966
france le conseiller national c est m jean wilhelm du parti conservateur chrétien social le chef politique est le secrétaire général,1966
tous les quatre ans opposa cependant au raz de marée démocrate chrétien une digue efficace au sénat la victoire de la,1966
prochaines élections législatives mille indices m ont suggéré que le parti démocrate chrétien qui traverse une crise de croissance pourrait s,1966
huis clos le août dernier au cours du congrès du parti crate chrétien pour donner du travail des éco les des,1966
fidel castro s est empressé de marquer le coup le parti crate chrétien est à présent aux mains de ses éléments,1966
discours du mai que le rappel de la doctrine du parti démocrate chrétien chilien telle que l a toujours définie m,1966
voyage en suède il semble encore que des personnalités du parti conservateur chrétien social soient venues assurer m chaudet de leur,1966
voit sa majorité réduite au conseil provincial de massa le parti démocrate chrétien de m aldo moro chef du gouvernement maintient,1966
faire front fribourg de notre correspondant hier à fribourg le parti conservateur chrétien social conviait une nouvelle fois les journalistes dans,1966
se déroule la campagne politique m paul torche président du parti conservateur chrétien social répondit aux questions des journalistes m torche,1966
m morard la confusion régnante ont conduit le pa rti conservateur chrétien social à adopter une telle for mulc quanj à,1966
apparentement s est fait entre radicaux socialistes et agraires les parti conservateur chrétien social et indépendant chrétien social ont conclu des,1966
convient de noter ces derniers jours un certain durcissement du parti conservateur à l égard des indépendants chrétiens sociaux si dans,1966
en vue de la grande réconciliation le journal officiel du parti conservateur chrétien social publiait jeudi un article dans lequel toute,1966
sociaux évangéliques réformés ce tableau traduit un important recul du parti conservateur chrétien social qui même avec les indépendants tiens sociaux,1966
ceux qui prêchent la fusion de ce parti au parti conservateur chrétiensocial la belle élection de m georges ducotterd tend à,1966
sa démission il a reçu d abord le secrétaire du parti démocrate chrétien m mariano rumor et devait rencontrer plus tard,1967
auquel ils appartiennent a été battu le chef du groupe démocrate chrétien a fait valoir pour sa part que la séance,1967
hui plus parmi les industriels que parmi le bâtiment du parti démocrate chrétien à santiago du chili j c spahni les,1967
le parti a décidé de ne cumuler aucun candidat le parti démocrate chrétien social du jura réuni en assemblée générale vendredi,1967
élections nationales le comité directeur et le comité cantonal du parti conservateur chrétien social bourgeois ont tenu samedi septembre leurs séances,1967
république eduardo frëi a été élu dimanche matin président du parti démocrate chrétien chilien à l issue de quinze heures de,1968
idéologue du parti les relations entre le gouvernement et le parti démocrate chrétien n ont cessé de se dégrader depuis six,1968
nombre de voix recueilli par chaque parti est le suivant parti conservateur chrétien social parti radical démocratique perte perte perte gain,1968
d un côté on trouve les grands partis jurassiens libéralradical chrétien social socialiste et les petits partis bernois indépendants jeune berne,1968
béral radical jurassien députés le parti socialiste jurassien ou le parti démocrate chrétien social se prononcent également en faveur d un,1968
prononcent également en faveur d un statut de minorité le parti démocratique chrétien social répondant à certaines propositions fait également remarquer,1968
homonyme bernois en revanche les partis libéral radical indépendant et chrétien social indépendant chacun député approuvent les propositions de la députation,1968
parti ccs fribourgeois de notre correspondant le comité cantonal du parti conservateur chrétien social fribourgeois a tenu une importante séance vendredi,1968
santé se voit obligé de renoncer à la présidence du parti conservateur chrétien social fribourgeois m torche continuera toutefois d assumer,1968
plutôt que de vaines querelles l assemblée générale annuelle du parti conservateur chrétien social fribourgeois les délégués du parti chrétiensocial fribourgeois,1968
fonctions que durant neuf ans m huonder qui appartenait au parti conservateur chrétien social présidait l exécutif de son canton pour,1968
rumor formateur rome juin m mariano rumor secrétaire général du parti démocrate chrétien a été désigné lundi par le président giuseppe,1968
a succédé à m aldo moro à la tête du parti démocrate chrétien ap depuis plusieurs jours à la suite du,1968
forum avec mm franz joseph kurmann conseiller national président du parti conservateur chrétien social suisse edgardo giovannini recteur de l université,1968
droit aux universités de fribourg et de munich membre du parti conservateur chrétien social il siégea au grand conseil tessinois de,1968
fribourg un nouveau président conservateur le comité cantonal du parti conservateur chrétien social fribourgeois s est réuni le mercredi octobre,1968
du gouvernement a provoqué une crise dans les rangs du parti démocrate chrétien moscou un nouveau satellite artificiel de la terre,1968
la direction du gouvernement rome novembre le conseil national du parti démocrate chrétien a désigné lundi soir son secrétaire général m,1968
des quartiers des divisions linguistiques et autres rappelons que le parti conservateur chrétien social dispose de la majorité dans le plus,1968
est livrée entre les partisans de deux partis distincts le parti conservateur et le parti chrétien sovial tous deux confondus dans,1968
être réunis tuote la journée de jeudi les dirigeants du parti démocrate chrétien se sont engagés à entreprendre les réformes fiscales,1968
et portant sur bulletin dépouillés m rafaël caldera candidat du parti démocrate chrétien a obtenu voix tr et m gonzalo barrios,1968
parcouru un à un les degrés du cursus honorum du parti démocrate chrétien ancien rédacteur en chef du journal liberazione nazionale,1969
cuivre réforme agraire problèmes des bidonvilles analphabétisme formation civique le parti démocrate chrétien en dépit des réformes sociales de grande envergure,1969
surprises peuvent donc surgir d ici à d ailleurs le parti démocrate chrétien n est pas aussi désuni que ses rivalités,1969
ces chiffres sont significatifs pour l ensemble du pays le parti démocrate chrétien reste bien l organisation la plus forte en,1969
le cas du valais est particulier du fait que le parti conservateur chrétien social étant majoritaire c est lui qui règle,1969
sous la république d une réforme agraire avortée le vrai parti démocrate chrétien d aujourd hui sa tendance la plus dynamique,1969
du parti socialiste et quelques députés de la gauche du parti démocrate chrétien membres de la coalition se sont alignés sur,1969
les rangs conservateurs le jeudi mai le comité directeur du parti conservateur chrétien social de sion siégeant sous la présidence de,1969
loi conservateurs fribourgeois de notre correspondant le comité cantonal du parti conservateur chrétien social fribourgeois s est réuni samedi à fribourg,1969
d ailleurs remarqué l orateur valaisan du dernier congrès du parti conservateur chrétien social le législateur n a en aucune manière,1969
déclarations faites dimanche déjà par les étudiants zurichois et je parti conservateur chrétien social c est rassurant écrit dans la nouvelle,1969
un groupe de députes appartenant à l aile gauche du parti démocrate chrétien chilien pdc ont rédigé un projet de loi,1969
d un dialogue avec le pci devant les assises du parti démocrate chrétien italien rome juin m aldo moro ancien président,1969
parti communiste dans un long discours devant le congrès national démocrate chrétien nous devons être attentifs à la présence de ce,1969
aux applaudissements de ses amis de l aile gauche du parti démocrate chrétien l orateur devait être interrompu à plusieurs reprises,1969
leur parti m flaminio piccoli a été réélu secrétaire du parti démocrate chrétien au terme d une réunion du conseil national,1969
rumor désigné formateur par m saragat rome juillet m rumor démocrate chrétien a été chargé par m saragat président de la,1969
sont les positions officielles des partis du centre gauche le parti démocrate chrétien avec députés à la chambre refuse d envisager,1969
elle lui ferait subir l usure du pouvoir le même parti démocrate chrétien refuse également de proposer des élections anticipées le,1969
du même automne que plusieurs parlements cantonaux et que le parti conservateur chrétien social suisse interviennent eux mêmes et demandent à,1969
toujours fort à désirer la scission au sein d u parti démocrate chrétien semble à l origine de la nervosité dtt,1969
la solidité de sa propre formation m piccoli secrétaire du parti démocrate chrétien serait prêt à démissionner à la suite d,1969
depuis ans il illustre également les propos du leader du parti démocrate chrétien au bundestag m rainer barzel de ne pas,1969
vue dés élections communales à fribourg une assemblée extraordinaire du parti indépendant chrétien social de là ville de fribourg s est,1969
les chrétiens sociaux avaient présenté une liste commune avec lé parti conservateur chrétien social ats ouverture de la saison hivernale en,1969
le suffrage chrétiens sociaux féminin en valais les délégués du parti conservateur chrétien social valaisan réunis en congrès à martigny le,1969
et du groupe d études pour la politique familiale du parti conservateur chrétien social suisse les délégués constatant que l heure,1969
de voter à la femme valaisanne demandent aux adhérents du parti conservateur chrétien social et à tous les citoyens valaisans de,1969
ce qui concerne l initiative avs interpartis les délégués du parti conservateur estiment qu elle répond à un besoin urgent car,1969
à la réunion outre m rumor m forlani secrétaire du parti démocrate chrétien m de martino secrétaire du parti socialiste m,1969
de martino secrétaire du parti socialiste m ferri secrétaire du parti social démocrate et m la malfa secrétaire du parti républicain,1969
chef du vaterland à lucerne elu sur la liste du parti chrétien social il a siégé au conseil national de à,1969
à karl wick a été en outre vice président du parti conservateur chrétien social de suisse ordinateur avant de clore sa,1969
suisse alémanique quant au parti de m von moos le parti conservateur chrétien social il réagit lui aussi et qualifie ces,1969
un départ rapide de m von moos et que le parti conservateur apporte du sang frais à l exécutif or maintenant,1969
moos par la revue neutralitat le service de presse du parti conservateur chrétien social répond en les qualifiant de basse vengeance,1969
et ludwig von moos conseillers fédéraux le comité central du parti conservateur chrétien social a décidé de soutenir l arrêté fédéral,1970
penchant pour des jeux stériles aussi face aux candidats du parti conservateur droite m jorge alessandri déjà président de à et,1970
droite m jorge alessandri déjà président de à et du parti démocrate chrétien m rodomiro tomic cinq candidatures étaientelles avancées la,1970
depuis lors une scission s est produite au sein du parti conservateur chrétien social une partie de l aile gauche s,1970
de l aile gauche s est séparée pour fonder le parti indépendant chrétien social c est la piemière fois que celui,1970
pas le quorum mais qu ayant puisé dans l électorat conservateur ce parti perde quand même un siège au profit sans,1970
les entreprises de fraude de pressions et de tricheries le parti démocrate chrétien social du jura et le parti chrétien social,1970
parti démocrate chrétien social du jura et le parti chrétien social indépendant demandent également de rejeter la modification de la loi,1970
sièges les conservateurs chrétiens sociaux en obtiennent les socialistes le parti indépendant chrétien social qui n en avait pas jusqu ici,1970
été obtenus grâce au plus fort reste sauf celui du parti conservateur chrétien social qui a obtenu ses sièges en plein,1970
former un gouvernement a dit m arnaldo forlani secrétaire du parti démocrate chrétien ap,1970
celio dans une interview accordée au service de presse du parti conservateur chrétien social ccs d ailleurs le gouvernement estime qu,1970
sur la politique conjoncturelle demandé notamment par deux députés du parti conservateur chrétien social il devrait être publié vers l automne,1970
parlementaire dans une interview accordée au service de presse du parti conservateur chrétien social le conseiller fédéral celio avait déclaré qu,1970
fribourg nouveau président au parti conservateur chrétien social non à l initiative schwarzenbach de notre,1970
l initiative schwarzenbach de notre correspondant le comité cantonal du parti conservateur chrétien social fribourgeois a tenu une importante séance hier,1970
non unanime du parti conservateur chrétien social initiative contre l emprise étrangère l assemblée,1970
initiative contre l emprise étrangère l assemblée des délégués du parti conservateur chrétien social suisse s est réunie samedi à baden,1970
m roger mugny conseiller national et municipal à lausanne le parti conservateur chrctien social suisse a dit un non unanime à,1970
m malfatti est ministre des postes et télécommunications il est démocrate chrétien de gauche ap un jeune démocratechrétien de gauche actuel,1970
gauche de m mariano rumor m malfatti est membre du parti démocrate chrétien mais la faction à laquelle il appartient est,1970
préavis pour l élection des préfets par le peuple le parti conservateur chrétien social a pris la même attitude que le,1970
l élection des conseillers aux etats par le souverain le parti indépendant chrétien social de son côté combat l élection des,1970
le peuple personne ne la combat à l exception du parti indépendant chrétien social on relèvera,1970
au racisme et à la ségrégation il popolo organe du parti démocrate chrétien en italie a écrit en première page dans,1970
ministre du travail et membre de l aile gauche du parti démocrate chrétien a affirmé nous marchons dans le noir la,1970
juillet de l année passée une initiative lancée par le parti conservateur chrétien social et qui demandait l introduction du suffrage,1970
le parti conservateur pour lef oui h t jt m initiative pour,1970
initiative pour le droit au logement les quelque délégués du parti conservateur chrétien social suisse réunis en assemblée samedi à bienne,1970
fédérale sur le ché du logement aujourd hui le député chrétien social s étonne que des voix conservatrices combattent une initiative,1970
du parti estime le secrétaire de la section tessinoise du parti conservateur chrétien social ie ne faut pas proclamer certaines théories,1970
